ссылка на товар,бренд,наименование,промо цена,регулярная цена,id товараhttps://4lapy.ru/catalog/sobaki/korm-sobaki/konservy-korm-sobaki/Gurman_Silver_konservirovannyy_korm_dlya_sobak_govyadina_s_krevetkami_v_gele_100_g_1010198.html,Четвероногий Гурман,"Silver Line консервы для собак, говядина с креветками, 100 г",137,137,42112
https://4lapy.ru/catalog/sobaki/korm-sobaki/holistik/konsersy-dlya-sobak-s-perepelkoy-kuritsey-i-ovoshchami.html,Berkley,"Консервы для собак с перепелкой, курицей и овощами, 200гр.",153,153,139003
https://4lapy.ru/catalog/sobaki/korm-sobaki/konservy-korm-sobaki/AVVA_konservirovannyy_korm_dlya_sobak_melkih_porod_kusochki_yagnenka_v_gele_100_g_1016264.html,Aвва,"Консервы для собак мелких пород, с кусочками ягненка в желе, 100 гр.",65,65,42052
https://4lapy.ru/catalog/sobaki/korm-sobaki/holistik/konsersy-dlya-sobak-s-koninoy-yagnenkom-i-yablokami.html,Berkley,"Консервы для собак с кониной, ягненком и яблоками, 200гр.",153,153,139005
https://4lapy.ru/catalog/sobaki/korm-sobaki/sukhoy-korm-sobaki/sukhoy-korm-acti-protect-dlya-vzroslykh-sobak-s-chuvstvitelnym-pishchevareniem-s-vysokim-soderzhaniem-yagnenka-3kg.html,PRO PLAN®,"Acti protect Сухой корм для собак с чувствительным пищеварением, с ягненком, 3 кг",1988,2485,155701
https://4lapy.ru/catalog/sobaki/korm-sobaki/konservy-korm-sobaki/optisavour-vlazhnyy-korm-dlya-sobak-s-chuvstvitelnym-pishchevareniem-c-lososem-85g.html,PRO PLAN®,"Opti Savour влажный корм для взрослых собак для мелких и карликовых пород при чувствительном пищеварении с лососем, в соусе, 85 г",75,93,129574
https://4lapy.ru/catalog/sobaki/korm-sobaki/konservy-korm-sobaki/farmina-n-d-dog-duck-pumpkin-mini.html,Farmina,"N&D PUMPKIN влажный корм для собак, с уткой и тыквой, 140г",315,315,119953
https://4lapy.ru/catalog/sobaki/korm-sobaki/dieticheskiy-korm-sobaki/pd-c-d-korm-d-sob-pri-struvitah-6h1-5kg.html,Hill's,"Prescription Diet c/d Multicare Urinary Care Сухой диетический корм для собак при профилактике мочекаменной болезни (мкб), с курицей, 1,5 кг",2815,2815,143057
https://4lapy.ru/catalog/sobaki/korm-sobaki/konservy-korm-sobaki/kolbasa-dlya-sobak-myasnoy-racion-s-pechenyu-500g.html,Yummy,"Колбаса для собак мясной рацион с печенью, 500г",235,235,127725
https://4lapy.ru/catalog/sobaki/korm-sobaki/dieticheskiy-korm-sobaki/Korm_dlya_sobak_Hills__melkie_i_miniatyurnye_porody_Layt_kuritsaindeykapak_14_kg_1018595.html,Hill's,"Science Plan Light Сухой корм для собак мелких пород для поддержания здорового веса, с курицей и рисом, 1,5 кг",2095,2095,104649
https://4lapy.ru/catalog/sobaki/korm-sobaki/konservy-korm-sobaki/Gurman_korm_dlya_sobak_sosiski_yorkshirskie_bn__240g_1003222.html,Четвероногий Гурман,"Сосиски Йоркширские для собак, 240г",163,163,42091
https://4lapy.ru/catalog/sobaki/tovary-dlya-shchenkov/korm-zaveli-shchenka/konservy-dlya-shchenkov-nezhnye-kusochki-telyatiny-v-zhele-100g.html,Aвва,"Влажный корм (консервы) для щенков, с нежными кусочками телятины в желе, 100 гр.",65,65,157696
https://4lapy.ru/catalog/sobaki/korm-sobaki/sukhoy-korm-sobaki/Korm_dlya_sobak_melkih_porod_s_kuritsey_Eukanuba_Edaltoll_s_kuritsey.html,Eukanuba,"Adult Small Breed корм для собак мелких пород старше 1 года, с курицей, 3 кг",1655,1655,45748
https://4lapy.ru/catalog/sobaki/korm-sobaki/konservy-korm-sobaki/Gurman_Golden__100g_TSyplenok_i_krolik_v_gele_dlya_shchenkov_1007132.html,Четвероногий Гурман,"Golden Line Baby консервы для щенков, с цыпленком и кроликом, 100 г",139,139,40622
https://4lapy.ru/catalog/sobaki/korm-sobaki/dieticheskiy-korm-sobaki/korm-suhoy-dlya-vzroslyh-sobak-melkih-porod-dlya-resheniya-problem-s-kozhey-i-sherstyu-2kg.html,UNICA,"Корм сухой для взрослых собак средних пород для решения проблем с кожей и шерстью, 2 кг",2135,2135,159366
https://4lapy.ru/catalog/sobaki/korm-sobaki/dieticheskiy-korm-sobaki/Royal_Canin_Diabetic_DS37_dieticheskiy_suhoy_korm_dlya_sobak_pri_saharnom_diabete.html,Royal Canin,"Diabetic DS37 корм для собак при сахарном диабете, 1,5 кг",2315,2315,42657
https://4lapy.ru/catalog/sobaki/korm-sobaki/konservy-korm-sobaki/Gurman_Silver_konservirovannyy_korm_dlya_sobak_krolik_s_krabami_v_gele_100_g_1010197.html,Четвероногий Гурман,"Silver Line консервы для собак, кролик с крабами, 100 г",143,143,42110
https://4lapy.ru/catalog/sobaki/korm-sobaki/dieticheskiy-korm-sobaki/korm-suhoy-dlya-vzroslyh-sobak-melkih-porod-dlya-resheniya-problem-s-pishchevareniem-800g.html,UNICA,"Корм сухой для взрослых собак мелких пород для решения проблем с пищеварением, 800 гр.",1049,1049,159364
https://4lapy.ru/catalog/sobaki/korm-sobaki/sukhoy-korm-sobaki/korm-suhoy-dlya-vzroslyh-sobak-melkih-porod-kurica.html,Brit,"Корм сухой для взрослых собак мелких пород курица, 1 кг",348,435,137918
https://4lapy.ru/catalog/sobaki/korm-sobaki/holistik/konsersy-dlya-sobak-s-krolikom-govyadinoy-i-bolgarskim-pertsem.html,Berkley,"Консервы для собак с кроликом, говядиной и болгарским перцем, 200гр.",153,153,139007
https://4lapy.ru/catalog/sobaki/korm-sobaki/dieticheskiy-korm-sobaki/korm-vlazhnyy-dlya-sobak-meta-korrektsiya-vesa-370g.html,Hill's,"Prescription Diet Metabolic Влажный диетический корм (консервы) для собак способствующий снижению и контролю веса, с курицей, 370 гр.",495,549,159201
https://4lapy.ru/catalog/sobaki/korm-sobaki/sukhoy-korm-sobaki/sp-korm-d-sob-dekor-pishchevarenie-1-5kg.html,Hill's,"Science Plan Perfect Digestion Сухой корм для взрослых собак мелких пород для поддержания здоровья пищеварения и питания микробиома, с курицей и коричневым рисом, 1.5 кг",1572,2095,135935
https://4lapy.ru/catalog/sobaki/korm-sobaki/sukhoy-korm-sobaki/Pro_Plan_Puppy_suhoy_korm_dlya_shchenkov_srednih_porod_kuritsaris.html,PRO PLAN®,"Medium Puppy Сухой корм для щенков средних пород, с высоким содержанием курицы, 3 кг",1878,2347,42342
https://4lapy.ru/catalog/sobaki/korm-sobaki/dieticheskiy-korm-sobaki/Royal_Canin_Renal_dieticheskiy_suhoy_korm_dlya_sobak_pri_pochechnoy_nedostatochnosti.html,Royal Canin,"Renal RF14 Сухой корм для собак при почечной недостаточности, 2 кг",3139,3139,42644
https://4lapy.ru/catalog/sobaki/korm-sobaki/sukhoy-korm-sobaki/korm-suhoy-dlya-shchenkov-mini-porod-s-yagnenkom-i-indeykoy.html,AlphaPet,"Сухой корм для щенков мини пород с ягненком и индейкой, 500 г",465,547,146253
https://4lapy.ru/catalog/sobaki/korm-sobaki/dieticheskiy-korm-sobaki/Purina_Veterinary_Diets_UR_dieticheskiy_suhoy_korm_dlya_sobak_pri_MKB_pak__3kg_1003404.html,PRO PLAN® Veterinary Diets,"Veterinary Diets UR ST/OX Urinary Сухой диетический корм для собак при болезнях нижних отделов мочевыводящих путей, 3 кг",4705,4705,42634
https://4lapy.ru/catalog/sobaki/korm-sobaki/dieticheskiy-korm-sobaki/ppvd-drm-sobaka-dermatoz-4h1-5kg.html,PRO PLAN® Veterinary Diets,"Veterinary Diets DRM Dermatosis сухой корм для щенков и взрослых собак при дерматозах и выпадении шерсти, 1,5 кг",2645,2645,120473
https://4lapy.ru/catalog/sobaki/korm-sobaki/dieticheskiy-korm-sobaki/pd-k-d-korm-d-sob-d-pochek-6h1-5kg.html,Hill's,"Prescription Diet k/d Сухой диетический корм для собак при хронической болезни почек, 1,5 кг",3285,3285,143079
https://4lapy.ru/catalog/sobaki/korm-sobaki/dieticheskiy-korm-sobaki/korm-suhoy-royal-kanin-dlya-kastrirovannyh-sobak-srednih-porod-nyutrid-me.html,Royal Canin,"Neutered Adult корм для кастрированных собак средних размеров, 3,5 кг",3447,3447,50554
https://4lapy.ru/catalog/sobaki/korm-sobaki/konservy-korm-sobaki/konservy-dlya-sobak-s-kuritsey.html,Hill's,"Science Plan Консервы для взрослых собак для поддержания мышечной массы и здорового иммунитета, с курицей, 370 гр.",292,365,137008
https://4lapy.ru/catalog/sobaki/korm-sobaki/sukhoy-korm-sobaki/korm-dlya-sobak-srednih-porod-s-govyadinoy.html,DELICANA,"Корм для собак средних пород с говядиной, 2 кг",795,795,142915
https://4lapy.ru/catalog/sobaki/korm-sobaki/konservy-korm-sobaki/farmina-n-d-dog-duck-pumpkin.html,Farmina,"N&D PUMPKIN влажный корм для собак, с уткой и тыквой, 285г",599,599,120789
https://4lapy.ru/catalog/sobaki/korm-sobaki/konservy-korm-sobaki/korm-vlazhnyy-dlya-sobak-olenina-v-bulone.html,Погрызухин,"Monoprotein Корм влажный (консервы) для собак, оленина в бульоне, 338 гр.",289,289,122617
https://4lapy.ru/catalog/sobaki/korm-sobaki/sukhoy-korm-sobaki/Royal_Canin_Maxi_Ageing_suhoy_korm_dlya_sobak_krupnyh_porod_starshe_8et.html,Royal Canin,"Maxi Ageing 8+ корм для пожилых собак крупных пород старше 8 лет, 15 кг",9455,9455,42421
https://4lapy.ru/catalog/sobaki/korm-sobaki/sukhoy-korm-sobaki/korm-suhoy-dlya-shchenkov-krupnyh-porod-s-govyadinoy.html,AlphaPet,"Сухой корм для щенков крупных пород с говядиной, 3 кг",2469,2469,146263
https://4lapy.ru/catalog/sobaki/korm-sobaki/dieticheskiy-korm-sobaki/Royal_Canin_Neutered_Adultall_Dog_korm_dieticheskiy_suhoy_dlya_sobak.html,Royal Canin,"Neutered Adult Small Dog корм для кастрированных собак мелких размеров, 800 г",935,935,42655
https://4lapy.ru/catalog/sobaki/korm-sobaki/holistik/avva-kons-100g-dlya-sobak-melkih-porod-cyplenok-indeyka-s-yablokom.html,Aвва,"Adult Консервы для взрослых собак мелких пород, цыпленок и индейка с яблоком, 100 гр.",99,99,137533
https://4lapy.ru/catalog/sobaki/korm-sobaki/dieticheskiy-korm-sobaki/korm-suhoy-dlya-vzroslyh-sobak-melkih-porod-dlya-resheniya-problem-s-kozhey-i-sherstyu-800g.html,UNICA,"Корм сухой для взрослых собак мелких пород для решения проблем с кожей и шерстью, 800 гр.",1049,1049,159503
https://4lapy.ru/catalog/sobaki/korm-sobaki/sukhoy-korm-sobaki/Trapeza_suh__10kg_Dsobak_Bio_1022650.html,Трапеза,"Bio корм для собак всех пород старше 1 года с нормальной активностью, 10 кг",1949,1949,49202
https://4lapy.ru/catalog/sobaki/korm-sobaki/sukhoy-korm-sobaki/Korm_dlya_shchenkov_melkih_porod_Proplan_chuvstvitelnaya_koga_Lososris_1004883.html,PRO PLAN®,"Opti Derma сухой корм для щенков для мелких и карликовых пород при чувствительной коже с лососем, 700 г",669,669,46865
https://4lapy.ru/catalog/sobaki/tovary-dlya-shchenkov/korm-zaveli-shchenka/Gurman_konservirovannyy_korm_dlya_shchenkov_Myasnoe_assorti_yagnenok_bn__100g_1003615.html,Четвероногий Гурман,"консервированный корм для щенков, Мясное ассорти ягненок, бн. 100г",89,89,42093
https://4lapy.ru/catalog/sobaki/korm-sobaki/sukhoy-korm-sobaki/korm-suhoy-dlya-sobak-melkih-porod-s-olenem-risom-i-morkovyu-800g.html,UNICA,"Корм сухой для собак мелких пород, с оленем, рисом и морковью, 800 гр.",629,629,159370
https://4lapy.ru/catalog/sobaki/korm-sobaki/konservy-korm-sobaki/Dr_Alders_My_Lord_Sensetive_konservirovannyy_korm_dlya_sobak_yagnenok_1230_g_1016857.html,Dr. Alder's,"Мой Лорд Сенситив консервы для собак с чувствительным пищеварением,кусочки ягненка и рис в желе, 1,23 кг",465,465,47001
https://4lapy.ru/catalog/sobaki/korm-sobaki/konservy-korm-sobaki/avva-kons-100g-dlya-sobak-yagnenok.html,Aвва,"Adult Консервы для взрослых собак всех пород, с ягненком, 100 гр.",99,99,147531
https://4lapy.ru/catalog/sobaki/korm-sobaki/sukhoy-korm-sobaki/korm-dlya-sobak-standart-hills-s-kuricey-pak-2-5kg.html,Hill's,"Science Plan Сухой корм для взрослых собак средних пород для поддержания иммунитета, с курицей, 2,5 кг",2489,2489,82182
https://4lapy.ru/catalog/sobaki/korm-sobaki/sukhoy-korm-sobaki/Hills_suhoy_korm_dlya_shchenkov_melkih_i_karlikovyh_porod_kuritsey.html,Hill's,"Science Plan Сухой корм для щенков мелких пород для поддержания здорового роста и развития, с курицей, 1,5 кг",1705,1705,48572
https://4lapy.ru/catalog/sobaki/korm-sobaki/sukhoy-korm-sobaki/korm-dlya-sobak-srednikh-porod-indeyka-s-ovoshchami-2-kg.html,DELICANA,Корм для собак средних пород индейка с овощами 2 кг,723,850,148360
https://4lapy.ru/catalog/sobaki/tovary-dlya-shchenkov/korm-zaveli-shchenka/konservy-dlya-shchenkov-nezhnye-kusochki-cyplenka-v-zhele-100g.html,Aвва,"Влажный корм (консервы) для щенков, с нежными кусочками цыпленка в желе, 100 гр.",65,65,157694
https://4lapy.ru/catalog/sobaki/korm-sobaki/dieticheskiy-korm-sobaki/Purina_VetDieta_suh_3kg_Dsobak_patologiya_pecheni_HP_1015900.html,PRO PLAN® Veterinary Diets,"Veterinary Diets HP Hepatic сухой корм для щенков и взрослых собак для поддержания функции печени при хронической печеночной недостаточности, 3 кг",4999,4999,31904
https://4lapy.ru/catalog/sobaki/korm-sobaki/dieticheskiy-korm-sobaki/Purina_Veterinary_Diets_DRM_dieticheskiy_suhoy_korm_dlya_sobak_pri_dermatozah.html,PRO PLAN® Veterinary Diets,"DRM Dermatosis Сухой диетический корм для собак при дерматозах и выпадении шерсти, 12 кг",15985,15985,49081
https://4lapy.ru/catalog/sobaki/korm-sobaki/sukhoy-korm-sobaki/Eukanuba_Adultarge_suhoy_korm_dlya_sobak_krupnyh_porod_kuritsa.html,Eukanuba,"Adult Large Breed корм для собак крупных и очень крупных пород старше 1 года, с курицей, 15 кг",5899,5899,42301
https://4lapy.ru/catalog/sobaki/korm-sobaki/konservy-korm-sobaki/konservy-dlya-malenkih-sobak-kusochki-nezhnoy-telyatiny-v-zhele-100g.html,Aвва,"Влажный корм (консервы) для маленьких собак, с кусочками нежной телятины в желе, 100 гр.",65,65,157688
https://4lapy.ru/catalog/sobaki/korm-sobaki/sukhoy-korm-sobaki/Pro_Plan_Puppyall_suhoy_korm_dlya_shchenkov_melkih_porod_kuritsa_i_ris.html,PRO PLAN®,"Opti Start сухой корм для щенков для мелких и карликовых пород с курицей, 3 кг",2152,2689,31750
https://4lapy.ru/catalog/sobaki/korm-sobaki/dieticheskiy-korm-sobaki/Purina_Veterinary_Diets_JM_dieticheskiy_suhoy_korm_dlya_sobak_pri_patologii_sustavov.html,PRO PLAN® Veterinary Diets,"JM Joint Mobility Сухой диетический корм для щенков для поддержки работы суставов, 12 кг",15985,15985,64591
https://4lapy.ru/catalog/sobaki/korm-sobaki/konservy-korm-sobaki/konservy-dlya-sobak-s-yagnenkom.html,Berkley,"Консервы для собак с ягненком, 100гр.",125,125,138989
https://4lapy.ru/catalog/sobaki/korm-sobaki/sukhoy-korm-sobaki/Hills_suhoy_korm_dlya_sobak_miniatyurnyh_porod_s_chuvstvitelnym_pishchevareniem_kuritsa.html,Hill's,"Science Plan Sensitive Stomach & Skin Сухой корм для взрослых собак мелких пород с чувствительной кожей и (или) пищеварением, с курицей, 1,5 кг",2095,2095,42474
https://4lapy.ru/catalog/sobaki/korm-sobaki/konservy-korm-sobaki/optisavour-adult-vlazhnyy-korm-dlya-sobak-c-utkoy-v-souse-85g.html,PRO PLAN®,"Opti Savour влажный корм для взрослых собак для мелких пород с уткой, в соусе, 85 г",75,93,129572
https://4lapy.ru/catalog/sobaki/korm-sobaki/dieticheskiy-korm-sobaki/Purina_Veterinary_Diets_NF_dieticheskiy_suhoy_korm_dlya_sobak_pri_patologii_pochek_pak__3kg_1002947.html,PRO PLAN® Veterinary Diets,"NF Renal Function Сухой диетический корм для собак при хронической почечной недостаточности, 3 кг",4705,4705,42632
https://4lapy.ru/catalog/sobaki/korm-sobaki/dieticheskiy-korm-sobaki/ppvd-ur-sobaka-mochevydsistema-4h1-5kg.html,PRO PLAN® Veterinary Diets,"Veterinary Diets UR Urinary сухой корм для взрослых собак для взрослых собак для растворения струвитных камней, 1,5 кг",2615,2615,120479
https://4lapy.ru/catalog/sobaki/korm-sobaki/holistik/konservy-dlya-sobak-s-govyadinoy-100g.html,Berkley,"Консервы для собак с говядиной, 100гр.",125,125,138987
https://4lapy.ru/catalog/sobaki/korm-sobaki/sukhoy-korm-sobaki/Royal_Canin_Dachshund_28_Adult_suhoy_korm_dlya_sobak_porody_Taksa.html,Royal Canin,"Dachshund Adult корм для собак породы такса старше 10 месяцев, 1,5 кг",1263,1485,42389
https://4lapy.ru/catalog/sobaki/korm-sobaki/sukhoy-korm-sobaki/korm-suhoy-dlya-sobak-starshe-8-let-yorkshirskiy-terer.html,Royal Canin,Корм сухой для собак старше 8 лет Йоркширский терьер,1373,1615,110715
https://4lapy.ru/catalog/sobaki/korm-sobaki/dieticheskiy-korm-sobaki/korm-vlazhnyy-dlya-sobak-k-d-dlya-pochek-370g.html,Hill's,"Prescription Diet k/d Влажный диетический корм (консервы) для собак при хронической болезни почек, с курицей, 370 гр.",554,615,159197
https://4lapy.ru/catalog/sobaki/korm-sobaki/konservy-korm-sobaki/konservy-dlya-malenkih-sobak-kusochki-govyadiny-v-zhele-100g.html,Aвва,"Влажный корм (консервы) для маленьких собак, с кусочками говядины в желе, 100 гр.",65,65,157686
https://4lapy.ru/catalog/sobaki/korm-sobaki/konservy-korm-sobaki/korm-konservirovannyy-dlya-sobak-i-shchenkov-chetveronogiy-gurman-golden-line-muss-s-govyadinoy-100-g.html,Четвероногий Гурман,"Корм консервированный для собак и щенков Golden line Мусс с говядиной,100г",145,145,108455
https://4lapy.ru/catalog/sobaki/korm-sobaki/sukhoy-korm-sobaki/Korm_suhoy_dlya_sobak_Gurman_Momentalnaya_kasha_Knyageskaya_grechkaris_bn_300g_1019336.html,Четвероногий Гурман,"Золотые рецепты каша Княжеская для собак, 300 г",225,225,31684
https://4lapy.ru/catalog/sobaki/tovary-dlya-shchenkov/korm-zaveli-shchenka/Gurman_konservirovannyy_korm_dlya_shchenkov_Myasnoe_assorti_s_govyadinoy_bn__340g_1015444.html,Четвероногий Гурман,"Консервы для щенков, мясное ассорти с говядиной, 340 г",189,189,42114
https://4lapy.ru/catalog/sobaki/korm-sobaki/sukhoy-korm-sobaki/farmina-n-d-nizkozernovoy-dog-layt-kurica-spelta-oves-i-granat-dlyavzroslyh-sobak-mini-800g.html,Farmina,"Mini Light низкозерновой сухой корм для взрослых собак мелких пород, с курицей, спельтой, овсом и гранатом, 2,5кг",3195,3195,137271
https://4lapy.ru/catalog/sobaki/korm-sobaki/sukhoy-korm-sobaki/korm-suhoy-dlya-sobak-mini-porod-dermakmfort.html,Royal Canin,"Mini Dermacomfort сухой корм для собак маленьких пород, склонных к кожным раздражениям и зуду, 1кг",1127,1127,98480
https://4lapy.ru/catalog/sobaki/korm-sobaki/konservy-korm-sobaki/AVVA_konservirovannyy_korm_dlya_sobak_melkih_porod_kusochki_kuritsy_s_govyadinoy_v_gele_100_g_1016265.html,Aвва,"Консервы для собак мелких пород, с кусочками курицы и говядиной в желе, 100 гр.",65,65,42054
https://4lapy.ru/catalog/sobaki/korm-sobaki/sukhoy-korm-sobaki/Korm_suhoy_dlya_sobak_Gurman_Momentalnaya_kasha_Bogatyrskaya_risovsyankabn__300g_1019335.html,Четвероногий Гурман,"Золотые рецепты каша Богатырская для собак, 300г",225,225,31679
https://4lapy.ru/catalog/sobaki/korm-sobaki/holistik/konservy-dlya-sobak-s-indeykoy-100g.html,Berkley,"Консервы для собак с индейкой, 100гр.",125,125,138993
https://4lapy.ru/catalog/sobaki/korm-sobaki/konservy-korm-sobaki/konservy-dlya-malenkih-sobak-myasnoe-assorti-kusochki-v-zhele-100g.html,Aвва,"Влажный корм (консервы) для маленьких собак, с кусочками мясного ассорти в желе, 100 гр.",65,65,157690
https://4lapy.ru/catalog/sobaki/korm-sobaki/sukhoy-korm-sobaki/korm-suhoy-dlya-vzroslyh-sobak-malyh-porod-s-indeykoy.html,Sirius,"Корм сухой для взрослых собак малых пород, с индейкой, 2 кг",899,899,146289
https://4lapy.ru/catalog/sobaki/korm-sobaki/konservy-korm-sobaki/vlazhnyy-korm-nabor-dlya-vzroslykh-sobak-melkikh-i-karlikovykh-porod-s-utkoy-v-souse-s-lososem-v-souse-10-85g.html,PRO PLAN®,"Набор паучей для собак мелких пород с уткой, лососем в соусе, 10х85 гр.",747,829,155699
https://4lapy.ru/catalog/sobaki/korm-sobaki/sukhoy-korm-sobaki/pro-plan-natur-el-cob-vzrmelpor-yagn-7kg.html,PRO PLAN®,"Nature Elements сухой корм для взрослых собак для мелких и карликовых пород с ягненком, 2 кг",2043,2043,131699
https://4lapy.ru/catalog/sobaki/korm-sobaki/dieticheskiy-korm-sobaki/korm-suhoy-dlya-sobak-ha-pri-allergii-mesh-11kg.html,PRO PLAN® Veterinary Diets,"HA Hypoallergenic Сухой диетический корм для собак при пищевой непереносимости, 11 кг",16829,16829,157383
https://4lapy.ru/catalog/sobaki/korm-sobaki/sukhoy-korm-sobaki/korm-suhoy-dlya-sobak-mini-porod-s-indeykoy-i-risom1.html,AlphaPet,"Сухой корм для собак мини пород с индейкой и рисом, 500 г",515,515,146250
https://4lapy.ru/catalog/sobaki/korm-sobaki/sukhoy-korm-sobaki/korm-dlya-sobak-melkih-porod-govyadina-s-ovoshchami.html,DELICANA,"Корм для собак мелких пород говядина с овощами, 1.5 кг",612,719,142912
https://4lapy.ru/catalog/sobaki/korm-sobaki/sukhoy-korm-sobaki/korm-suhoy-dlya-sobak-mini-porod-s-yagnenkom-i-risom.html,AlphaPet,"WOW Сухой корм для собак мини пород с ягненком и рисом, 900 г",599,599,146246
https://4lapy.ru/catalog/sobaki/korm-sobaki/sukhoy-korm-sobaki/Royal_Canin_suhoy_korm_dlya_shchenkov_porody_Yorkshirskiy_terer.html,Royal Canin,"Yorkshire Terrier Junior корм для щенков породы йоркширский терьер в возрасте до 10 месяцев, 1,5 кг",1331,1565,42381
https://4lapy.ru/catalog/sobaki/korm-sobaki/konservy-korm-sobaki/konservy-dlya-sobak-vseh-porod-cyplenok-tykva-240g.html,Aвва,"Adult Консервы для взрослых собак всех пород, цыпленок и тыква, 240 гр.",143,143,149596
https://4lapy.ru/catalog/sobaki/korm-sobaki/sukhoy-korm-sobaki/Korm_dlya_sobak_Gurman_kasha_ris_s_ovoshchami.html,Четвероногий Гурман,"Хлопья рисовые с морковью для собак, 400 г",175,175,42294
https://4lapy.ru/catalog/sobaki/korm-sobaki/konservy-korm-sobaki/monge-dog-monoproteico-solo-konservy-dlya-sobak-pashtet-iz-krolika-150g.html,Monge,"Monoprotein консервы для собак, с кроликом, 150 г",279,279,82070
https://4lapy.ru/catalog/sobaki/korm-sobaki/sukhoy-korm-sobaki/Korm_dlya_sobak_Gurman_kasha_grechka_s_ovoshchami.html,Четвероногий Гурман,"Хлопья гречневые с морковью для собак, 400 г",223,223,42292
