ссылка на товар,бренд,наименование,промо цена,регулярная цена,id товараhttps://4lapy.ru/catalog/sobaki/korm-sobaki/sukhoy-korm-sobaki/korm-dlya-sobak-srednih-porod-losos-s-risom.html,DELICANA,"Корм для собак средних пород лосось с рисом, 2 кг",919,919,142917
https://4lapy.ru/catalog/sobaki/korm-sobaki/konservy-korm-sobaki/korm-konservirovannyy-dlya-sobak-i-shchenkov-chetveronogiy-gurman-golden-line-muss-s-indeykoy-100-g.html,Четвероногий Гурман,"Корм консервированный для собак и щенков Golden line Мусс с индейкой,100г",145,145,108457
https://4lapy.ru/catalog/sobaki/tovary-dlya-shchenkov/korm-zaveli-shchenka/premium-dog-puppy-and-junior-small-s-kuritsey-dlya-shchenkov-i-molodykh-sobak.html,Brit,"Premium Dog Puppy and Junior Small с курицей для щенков и молодых собак, 1 кг",396,495,139888
https://4lapy.ru/catalog/sobaki/korm-sobaki/sukhoy-korm-sobaki/Royal_Canin_Pug_Adult_suhoy_korm_dlya_sobak_porody_Mops.html,Royal Canin,"Pug Adult корм для собак породы мопс от 10 месяцев, 1,5 кг",1263,1485,42393
https://4lapy.ru/catalog/sobaki/korm-sobaki/konservy-korm-sobaki/vlazhnyy-korm-nabor-dlya-vzroslykh-sobak-melkikh-i-karlikovykh-porod-s-govyadinoy-v-souse-s-kuritsey-v-souse-10-85g.html,PRO PLAN®,"Набор паучей для собак мелких пород с говядиной, курицей в соусе, 10х85 гр.",747,829,155697
https://4lapy.ru/catalog/sobaki/korm-sobaki/sukhoy-korm-sobaki/Royal_Canin_suhoy_korm_dlya_vzroslyh_sobak_v_vozraste_ot_10_mesyatsev_do_8let.html,Royal Canin,"Mini Indoor Adult, корм сухой для взрослых собак в возрасте от 10 месяцев, 3кг",2485,2485,42426
https://4lapy.ru/catalog/sobaki/korm-sobaki/sukhoy-korm-sobaki/korm-suhoy-dlya-sobak-srednih-porod-s-yagnenkom.html,Grand Prix,"Корм сухой для собак средних пород с ягненком 2,5 кг",1279,1279,145563
https://4lapy.ru/catalog/sobaki/korm-sobaki/holistik/korm-vlazhnyy-dlya-sobak-krolik.html,Crave,"Корм консервированный полнорационный для собак всех пород старше 1 года с кроликом, 85 г",105,105,134308
https://4lapy.ru/catalog/sobaki/korm-sobaki/holistik/korm-vlazhnyy-dlya-sobak-yagnenok.html,Crave,"Корм консервированный полнорационный для собак всех пород старше 1 года с ягненком, 85 г",105,105,134310
https://4lapy.ru/catalog/sobaki/tovary-dlya-shchenkov/korm-zaveli-shchenka/premium-dog-puppy-and-junior-large-and-giant-s-kuritsey-dlya-shchenkov-i-molodykh-sobak-krupnykh-i-gigantskikh-porod.html,Brit,"Premium Dog Puppy and Junior Large and Giant с курицей для щенков и молодых собак крупных и гигантских пород, 15 кг",5355,5355,139893
https://4lapy.ru/catalog/sobaki/sp-korm-d-sob-ideal-pishchevarenie-2-5kg.html,Hill's,"Science Plan Perfect Digestion Сухой корм для взрослых собак средних пород для поддержания здоровья пищеварения и питания микробиома, с курицей и коричневым рисом, 2.5 кг",2819,2819,135938
https://4lapy.ru/catalog/sobaki/korm-sobaki/holistik/konservy-dlya-sobak-s-koninoy.html,Berkley,"Консервы для собак с кониной, 100гр.",125,125,138991
https://4lapy.ru/catalog/sobaki/korm-sobaki/konservy-korm-sobaki/konservy-dlya-sobak-melkih-porod-s-kusochkami-kuricy-v-zhele-100g.html,Aвва,"Влажный корм (консервы) для собак мелких пород, с кусочками курицы в желе, 100 гр.",65,65,157692
https://4lapy.ru/catalog/sobaki/korm-sobaki/konservy-korm-sobaki/optisavour-adult-vlazhnyy-korm-dlya-sobak-c-kuricey-v-souse-85g.html,PRO PLAN®,"Opti Savour влажный корм для взрослых собак для мелких пород с курицей, в соусе, 85 г",75,93,129570
https://4lapy.ru/catalog/sobaki/korm-sobaki/holistik/korm-vlazhnyy-dlya-sobak-govyadina.html,Crave,"Корм консервированный полнорационный для собак всех пород старше 1 года с говядиной, 85 г",105,105,134304
https://4lapy.ru/catalog/sobaki/korm-sobaki/sukhoy-korm-sobaki/korm-suhoy-royal-kanin-dlya-sobak-krupnyh-porod-ot-5-let-mesh-4-kg.html,Royal Canin,"Maxi Adult 5+ корм для собак крупных пород с 5 до 8 лет, 15 кг",9259,9259,80007
https://4lapy.ru/catalog/sobaki/korm-sobaki/sukhoy-korm-sobaki/korm-suhoy-dlya-sobak-krupnyh-porod-s-yagnenkom.html,Grand Prix,"Корм сухой для собак крупных пород с ягненком, 2.5 кг",1279,1279,145567
https://4lapy.ru/catalog/sobaki/korm-sobaki/sukhoy-korm-sobaki/Korm_suhoy_Royal_Kanin_dlya_shchenkov_Dgayan_starter_do_2h_mes_ochen_krupnyhporod_i_beremennyh_soba_1022056.html,Royal Canin,Giant Starter Mother & Babydog Корм сухой для щенков до 2 месяцев,9559,9559,60906
https://4lapy.ru/catalog/sobaki/korm-sobaki/sukhoy-korm-sobaki/korm-suhoy-dlya-sobak-s-utkoy-i-kartofelem-pak-2-5kg.html,Hill's,"Science Plan Culinary Creations Сухой корм для взрослых собак средних пород для поддержания иммунитета, с уткой и картофелем, 2,5 кг",2615,2615,159183
https://4lapy.ru/catalog/sobaki/korm-sobaki/sukhoy-korm-sobaki/suhoy-korm-hills-science-plan-dlya-vzroslyh-sobak-melkih-porod-dlya-podderzhaniya-zdorovya-kozhi-i-shersti-s-kuricey-6-kg.html,Hill's,"Science Plan Сухой корм для взрослых собак мелких пород для поддержания здоровья кожи и шерсти, с курицей, 6 кг",5757,5757,104663
https://4lapy.ru/catalog/sobaki/korm-sobaki/sukhoy-korm-sobaki/korm-suhoy-dlya-sobak-melkih-porod-s-yagnenkom.html,Grand Prix,"Корм сухой для собак мелких пород с ягненком, 2.5 кг",1279,1279,145561
https://4lapy.ru/catalog/sobaki/korm-sobaki/sukhoy-korm-sobaki/Eukanuba_suhoy_korm_dlya_sobak_porody_Yorkshirskiy_Terer_kuritsa.html,Eukanuba,"Breed Specific Yorkshire Terrier корм для собак мелких пород старше 1 года, 2 кг",1515,1515,45749
https://4lapy.ru/catalog/sobaki/korm-sobaki/sukhoy-korm-sobaki/korm-suhoy-royal-kanin-dlya-shchenkov-krupnyh-porod-maksi-starter-do-2-mes-mesh-4-kg.html,Royal Canin,"Maxi Starter корм для щенков крупных пород до 2-х месяцев, беременных и кормящих сук, 4 кг",3159,3159,80145
https://4lapy.ru/catalog/sobaki/korm-sobaki/sukhoy-korm-sobaki/Royal_Canin_Chihuahua_Junior_suhoy_korm_dlya_sobak_porody_Chihuahua.html,Royal Canin,"Chihuahua Junior корм для щенков породы чихуахуа до 8 месяцев, 500 г",569,569,42412
https://4lapy.ru/catalog/sobaki/korm-sobaki/sukhoy-korm-sobaki/Hills_suhoy_korm_dlya_shchenkov_i_beremennyh_sobak_melkihsrednih_porod_kuritsey.html,Hill's,"Science Plan Сухой корм для щенков мелких пород для поддержания здорового роста и развития, с курицей, 3 кг",2999,2999,45781
https://4lapy.ru/catalog/sobaki/korm-sobaki/sukhoy-korm-sobaki/korm-suhoy-dlya-sobak-vseh-porod-s-indeykoy-i-yagnenkom-1-5kg.html,Brit,"Корм сухой для собак всех пород, с индейкой и ягненком, 12 кг",7883,7883,164084
https://4lapy.ru/catalog/sobaki/korm-sobaki/konservy-korm-sobaki/Dr_Alders_My_Lord_konservirovannyy_korm_dlya_sobak_krolikserdtse_1230_g_1016856.html,Dr. Alder's,"Мой Лорд Классик консервы для взрослых собак, кусочки сердца и кролика в желе, 1,23 кг",465,465,46997
https://4lapy.ru/catalog/sobaki/korm-sobaki/sukhoy-korm-sobaki/suhoy-korm-dlya-shchenkov-krupnyh-porod-s-vysokim-soderzhaniem-kuricy-3kg.html,PRO PLAN®,"Opti Start сухой корм для щенков для крупных пород с курицей, 12 кг",6260,7825,126375
https://4lapy.ru/catalog/sobaki/korm-sobaki/sukhoy-korm-sobaki/korm-suhoy-dlya-sobak-srednih-i-krupnyh-porod-s-yagnenkom-i-risom-mesh-10kg.html,Purina ONE®,"Корм сухой для собак средних и крупных пород, с ягненком и рисом, 10 кг",3735,4149,157371
https://4lapy.ru/catalog/sobaki/korm-sobaki/holistik/korm-vlazhnyy-dlya-sobak-kuritsa.html,Crave,"Корм консервированный полнорационный для собак всех пород старше 1 года с курицей, 85 г",105,105,134306
https://4lapy.ru/catalog/sobaki/korm-sobaki/sukhoy-korm-sobaki/korm-suhoy-royal-kanin-dlya-sobak-medium-derma-komfort-mesh-10-kg.html,Royal Canin,"Medium Dermacomfort корм для собак средних пород, склонных к кожным раздражениям, 10 кг",7917,7917,80162
https://4lapy.ru/catalog/sobaki/korm-sobaki/dieticheskiy-korm-sobaki/Korm_dieticheskiy_dlya_sobak_Setaeti_Veyt_Menedgmentmesh__12_kg_1016243.html,Royal Canin,"Корм сухой для собак Сатаети Вейт Менеджмент, 1,5 кг",2325,2325,86948
https://4lapy.ru/catalog/sobaki/korm-sobaki/dieticheskiy-korm-sobaki/korm-sukhoy-dlya-sobak-nf-dlya-podderzhaniya-funktsii-pochek-pri-khronicheskoypochechnoy-nedostatochnosti.html,PRO PLAN® Veterinary Diets,Корм сухой для собак NF для поддержания функции почек при хроническойпочечной недостаточности,2649,2649,148647
https://4lapy.ru/catalog/sobaki/korm-sobaki/konservy-korm-sobaki/optisavour-vlazhnyy-korm-dlya-sobak-kontrol-vesa-s-kuritsey-85g.html,PRO PLAN®,"Opti Savour влажный корм для взрослых собак для мелких и карликовых пород при склоннности к набору веса с курицей, в соусе, 85 г",75,93,129568
https://4lapy.ru/catalog/sobaki/korm-sobaki/sukhoy-korm-sobaki/Royal_Canin_33_Junior_suhoy_korm_dlya_shchenkov_porodyabrador_Retriver.html,Royal Canin,"Labrador Retriever Junior 33 для щенков лабрадора до 15 месяцев, 12 кг",9639,9639,49398
https://4lapy.ru/catalog/sobaki/korm-sobaki/konservy-korm-sobaki/korm-vlazhnyy-dlya-sobak-olenina-s-tykvoy.html,Погрызухин,"Holistic Корм влажный (консервы) для собак, оленина с тыквой, 338 гр.",279,279,122623
https://4lapy.ru/catalog/sobaki/korm-sobaki/sukhoy-korm-sobaki/korm-suhoy-royal-kanin-dlya-sobak-srednih-porod-starshe-7-let-mesh-15-kg.html,Royal Canin,"Medium Adult 7+ корм для собак средних пород от 7 до 10 лет, 15 кг",9265,9265,80154
https://4lapy.ru/catalog/sobaki/korm-sobaki/sukhoy-korm-sobaki/korm-suhoy-dlya-sobak-royal-kanin-medium-starter-mesh-4-kg.html,Royal Canin,"Medium Starter корм для щенков до 2-х месяцев, беременных и кормящих сук, 12 кг",8777,8777,76262
https://4lapy.ru/catalog/sobaki/korm-sobaki/sukhoy-korm-sobaki/korm-dlya-sobak-srednikh-porod-kuritsa-s-ovoshchami-2-kg.html,DELICANA,Корм для собак средних пород курица с овощами 2 кг,829,829,148362
https://4lapy.ru/catalog/sobaki/korm-sobaki/konservy-korm-sobaki/korm-vlazhnyy-dlya-sobak-olenina-s-moroshkoy.html,Погрызухин,"Holistic Корм влажный (консервы) для собак, оленина с морошкой, 338 гр.",269,269,122621
https://4lapy.ru/catalog/sobaki/korm-sobaki/sukhoy-korm-sobaki/suhoy-korm-dlya-shchenkov-srednih-i-melkih-porod-s-vysokim-soderzhaniem-kuricy-3kg.html,PRO PLAN®,"Opti Start сухой корм для щенков для средних и крупных пород с курицей, 12 кг",6260,7825,126378
https://4lapy.ru/catalog/sobaki/korm-sobaki/sukhoy-korm-sobaki/Pro_Plan_Duo_Delice_Adult_suhoy_korm_dlya_sobak_melkih_i_karlikovyh_porod_kuritsa.html,PRO PLAN®,"Duo Delice Сухой корм для взрослых собак мелких и карликовых пород, с высоким содержанием курицы, 2,5 кг",2265,2265,45766
https://4lapy.ru/catalog/sobaki/korm-sobaki/sukhoy-korm-sobaki/Hills_suhoy_korm_dlya_sobak_krupnyh_porod_kuritsey.html,Hill's,"Science Plan Сухой корм для взрослых собак крупных пород для поддержания здоровья суставов и мышечной массы, с курицей, 2,5 кг",2489,2489,104647
https://4lapy.ru/catalog/sobaki/korm-sobaki/sukhoy-korm-sobaki/dog-adult-sukhoy-korm-dlya-vzroslykh-sobak-srednikh-porod-losos-i-yachmen12-kg.html,Guabi Natural,"Dog Adult Сухой корм для взрослых собак средних пород, лосось и ячмень, 12 кг",4620,9239,166331
https://4lapy.ru/catalog/sobaki/korm-sobaki/konservy-korm-sobaki/Dr_Alders_My_Lord_konservirovannyy_korm_dlya_sobak_govyadinapechen_1230_g_1016855.html,Dr. Alder's,"Мой Лорд Классик консервы для взрослых собак, кусочки печени и говядиныв желе, 1,23 кг",465,465,44082
https://4lapy.ru/catalog/sobaki/korm-sobaki/sukhoy-korm-sobaki/Pro_Plan_suhoy_korm_dlya_sobak_krupnyh_porod_s_moshchnym_teloslogeniem_yagnenok.html,PRO PLAN®,"Opti Digest сухой корм для взрослых собак для крупных пород с мощным телосложением при чувствительном пищеварении с ягненком, 14 кг",7336,9169,42366
https://4lapy.ru/catalog/sobaki/korm-sobaki/sukhoy-korm-sobaki/suhoy-korm-dlya-shchenkov-melkih-porod-cyplenok-i-korichnevyy-ris-pak-2-5kg.html,Guabi Natural,"Natural Puppy Сухой корм для щенков мелких пород с цыпленком и коричневым рисом, 2,5 кг",996,2490,159406
https://4lapy.ru/catalog/sobaki/korm-sobaki/konservy-korm-sobaki/avva-kons-800g-dlya-sobak-govyadina-yagnenok-i-golubika.html,Aвва,"Adult Консервы для взрослых собак всех пород, с говядиной, ягненком и голубикой, 800 гр.",315,315,147549
https://4lapy.ru/catalog/sobaki/korm-sobaki/konservy-korm-sobaki/korm-vlazhnyy-dlya-sobak-olenina-s-klyukvoy.html,Погрызухин,"Holistic Корм влажный (консервы) для собак, оленина с клюквой, 338 гр.",269,269,122619
https://4lapy.ru/catalog/sobaki/korm-sobaki/konservy-korm-sobaki/teishibo-korm-vlazhnyy-dlya-sobak-kurinoe-file-s-govyadinoy-v-zhele-80g.html,INABA CIAO,"Teishibo Корм влажный для собак, куриное филе с говядиной в желе, 80 гр.",189,189,164099
https://4lapy.ru/catalog/sobaki/korm-sobaki/konservy-korm-sobaki/gurman-myasnoe-assorti-100g-dlya-sobak-s-yagnenkom.html,Четвероногий Гурман,"Консервы для собак Мясное ассорти с ягненком, 340 г",179,179,135632
https://4lapy.ru/catalog/sobaki/korm-sobaki/sukhoy-korm-sobaki/Pro_Plan_Puppyarge_suhoy_korm_dlya_shchenkov_krupnyh_porod_kuritsaris.html,PRO PLAN®,"Large Robust Puppy Сухой корм для щенков крупных пород с мощным телосложением, с высоким содержанием курицы, 12 кг",6260,7825,31746
https://4lapy.ru/catalog/sobaki/korm-sobaki/konservy-korm-sobaki/teishibo-korm-vlazhnyy-dlya-sobak-kurinoe-file-s-kurinoy-pechenyu-v-zhele80g.html,INABA CIAO,"Teishibo Корм влажный для собак, куриное филе с куриной печенью в желе, 80 гр.",189,189,164101
https://4lapy.ru/catalog/sobaki/korm-sobaki/sukhoy-korm-sobaki/korm-suhoy-dlya-sobak-royal-kanin-golden-retriver-pak-3-kg.html,Royal Canin,"Golden Retriever Adult корм для голден ретриверов старше 15 месяцев, 12 кг",9325,9325,31761
https://4lapy.ru/catalog/sobaki/korm-sobaki/sukhoy-korm-sobaki/Korm_dlya_sobak_Royal_Kanin_Buldog_24_Edalt.html,Royal Canin,"Bulldog Adult корм для английских бульдогов старше 12 месяцев, 12 кг",9155,9155,60862
https://4lapy.ru/catalog/sobaki/korm-sobaki/sukhoy-korm-sobaki/Royal_Kanin_suh__Rotveyler_YUnior_12_kg_Pitanie_dlya_shchenkov_porodyRotveyler_v_vozraste_ot_2_do_10_1015821.html,Royal Canin,"Junior Сухой корм для щенков породы ротвейлер в возрасте от 2 до 10 мес, 12 кг",9115,9115,50512
https://4lapy.ru/catalog/sobaki/korm-sobaki/konservy-korm-sobaki/teishibo-korm-vlazhnyy-dlya-sobak-kurinoe-file-s-tuntsom-i-ovoshchami-v-zhele-80g.html,INABA CIAO,"Teishibo Корм влажный для собак, куриное филе с тунцом и овощами в желе, 80 гр.",189,189,164107
https://4lapy.ru/catalog/sobaki/korm-sobaki/konservy-korm-sobaki/korm-vlazhnyy-dlya-sobak-melkih-porod-s-chuvstvitelnym-pishchevareniem-losos-ris-morkov-v-podlive.html,Purina ONE®,"Mini влажный корм для взрослых собак для мелких пород при чувствительном пищеварении с лососем, рисом и морковью, в подливе, 85 г",36,45,147255
https://4lapy.ru/catalog/sobaki/korm-sobaki/sukhoy-korm-sobaki/suhoy-korm-dlya-vzroslyh-sobak-melkih-porod-cyplenok-i-korichnevyy-ris-pak-2-5kg.html,Guabi Natural,"Natural Dog Сухой корм для взрослых собак мелких пород с цыпленком и коричневым рисом, 2,5 кг",1245,2490,159412
https://4lapy.ru/catalog/sobaki/korm-sobaki/konservy-korm-sobaki/korm-vlazhnyy-dlya-sobak-melkih-i-karlikovyh-porod-govyadina-kartofel-morkov-v-podlive.html,Purina ONE®,"Mini влажный корм для взрослых собак для мелких и карликовых пород при активном образе жизни с говядиной, картофелем и морковью, в подливе, 85 г",36,45,147251
https://4lapy.ru/catalog/sobaki/tovary-dlya-shchenkov/korm-zaveli-shchenka/hills-korm-dlya-shchenkov-krupnyh-porod-s-kuricey-pak-2-5-kg.html,Hill's,"Science Plan Сухой корм для щенков крупных пород с оптимальным содержанием энергии и минералов, с курицей, 2,5 кг",2329,2329,125715
https://4lapy.ru/catalog/sobaki/korm-sobaki/sukhoy-korm-sobaki/korm-dlya-sobak-melkih-porod-indeyka-s-ovoshchami-400-g.html,DELICANA,"Корм для собак мелких пород индейка с овощами 1,5 кг",739,739,148357
https://4lapy.ru/catalog/sobaki/korm-sobaki/sukhoy-korm-sobaki/korm-suhoy-dlya-sobak-krupnyh-porod-s-indeykoy-i-utkoy-3kg.html,Brit,"Корм сухой для собак крупных пород, с индейкой и уткой, 12 кг",7883,7883,164082
https://4lapy.ru/catalog/sobaki/korm-sobaki/konservy-korm-sobaki/avva-kons-800g-dlya-sobak-yagnenok.html,Aвва,"Adult Консервы для взрослых собак всех пород, с ягненком, 800 гр.",315,315,147551
https://4lapy.ru/catalog/sobaki/korm-sobaki/konservy-korm-sobaki/gurman-myasnoe-assorti-100g-dlya-sobak-s-indeykoy.html,Четвероногий Гурман,"Консервы для собак Мясное ассорти с индейкой, 340 г",179,179,135628
https://4lapy.ru/catalog/sobaki/korm-sobaki/dieticheskiy-korm-sobaki/purina-vetdieta-suh-3kg-d-sobak-nc-podderzh-funkcii-mozga.html,PRO PLAN® Veterinary Diets,"NC NeuroCare Сухой диетический корм для пожилых собак для поддержания функции мозга, 3 кг",5129,5129,79914
https://4lapy.ru/catalog/sobaki/korm-sobaki/konservy-korm-sobaki/gurman-myasnoe-assorti-100g-dlya-sobak-s-perepelkoy.html,Четвероногий Гурман,"Консервы для собак Мясное ассорти с перепелкой, 340 г",179,179,135629
https://4lapy.ru/catalog/sobaki/korm-sobaki/sukhoy-korm-sobaki/sukhoy-korm-acti-protect-dlya-vzroslykh-sobak-melkikh-i-karlikovykh-porod-s-chuvstvitelnoy-kozhey-s-vysokim-soderzhaniem-lososya-3kg.html,PRO PLAN®,"Acti protect Сухой корм для собак мелких пород с чувствительной кожей, с лососем, 3 кг",2432,3039,155709
https://4lapy.ru/catalog/sobaki/korm-sobaki/dieticheskiy-korm-sobaki/pd-l-d-korm-d-sob-d-pecheni-10kg.html,Hill's,"Prescription Diet l/d Сухой диетический корм для собак при заболеваниях печени, 1,5 кг",3225,3225,143040
https://4lapy.ru/catalog/sobaki/korm-sobaki/sukhoy-korm-sobaki/Gurman_korm_suhoy_dlya_sobak_kasha_4_zlaka_1002593.html,Четвероногий Гурман,"Хлопья 4 злака для собак, 400 г",85,85,42290
https://4lapy.ru/catalog/sobaki/korm-sobaki/sukhoy-korm-sobaki/korm-suhoy-dlya-sobak-melkih-porod-govyadina-i-ris.html,Purina ONE®,"Adult сухой корм для взрослых собак для мелких и карликовых пород с говядиной и рисом, 1,5 кг",544,679,147261
https://4lapy.ru/catalog/sobaki/korm-sobaki/konservy-korm-sobaki/korm-vlazhnyy-dlya-sobak-melkih-melkih-porod-utka-pasta-zelenaya-fasol-v-podlive.html,Purina ONE®,"Mini влажный корм для взрослых собак для мелких пород при активном образе жизни с уткой, пастой и зеленой фасолью, в подливе, 85 г",36,45,147253
https://4lapy.ru/catalog/sobaki/korm-sobaki/sukhoy-korm-sobaki/Eukanuba_suhoy_korm_dlya_vzroslyh_sobak_miniatyurnyh_porod_500_g_1015384.html,Eukanuba,"Adult Toy Breed корм для собак миниатюрных пород старше 1 года, с курицей, 500 г",315,315,46832
https://4lapy.ru/catalog/sobaki/korm-sobaki/sukhoy-korm-sobaki/korm-suhoy-dlya-sobak-srednih-i-krupnyh-porod-s-govyadinoy-i-risom-pak-3-8kg.html,Purina ONE®,"Корм сухой для собак средних и крупных пород, с говядиной и рисом, 3,8 кг",1420,1775,157369
https://4lapy.ru/catalog/sobaki/korm-sobaki/sukhoy-korm-sobaki/Korm_dlya_sobak_porody_nemetskaya_ovcharka_Royal_Kanin_Dgerman_SHeferd_24_Edalt.html,Royal Canin,"German Shepherd Adult корм для немецких овчарок старше 15 месяцев, 3 кг",2525,2525,60861
https://4lapy.ru/catalog/sobaki/korm-sobaki/sukhoy-korm-sobaki/korm-dlya-shchenkov-krupnyh-porod-s-cyplenkom.html,Наша Марка,"Корм для щенков крупных пород с цыпленком, меш. 18 кг",4199,4199,106766
https://4lapy.ru/catalog/sobaki/korm-sobaki/konservy-korm-sobaki/gurman-golden-100g-konina-naturalnaya-v-zhele-dlya-sobak.html,Четвероногий Гурман,"GOLDEN LINE Консервы для собак с кониной, 100 г",132,132,135638
https://4lapy.ru/catalog/sobaki/korm-sobaki/konservy-korm-sobaki/korm-vlazhnyy-dlya-vzroslykh-sobak-vsekh-porod-s-yagnenkom-v-souse-85g.html,Crave,"Корм влажный для взрослых собак всех пород, с ягненком в соусе, 85 гр.",105,105,157248
https://4lapy.ru/catalog/sobaki/korm-sobaki/holistik/pauch-bezzernovoy-dlya-sobak-kurica-losos-i-ovoshchi-100g.html,Guabi Natural,"Natural Dog Влажный корм беззерновой для собак с курицей, лососем и овощами, 100 г (пауч)",119,139,159404
https://4lapy.ru/catalog/sobaki/korm-sobaki/sukhoy-korm-sobaki/pro-plan-natur-el-sob-vzmelpor-los-6x2kg.html,PRO PLAN®,"Nature Elements сухой корм для взрослых собак для мелких и карликовых пород для здоровья кожи и шерсти с лососем, 2 кг",2043,2043,131697
https://4lapy.ru/catalog/sobaki/korm-sobaki/sukhoy-korm-sobaki/korm-dlya-sobak-melkih-porod-losos-s-risom.html,DELICANA,"Корм для собак мелких пород лосось с рисом, 1.5 кг",810,810,142913
https://4lapy.ru/catalog/sobaki/korm-sobaki/sukhoy-korm-sobaki/korm-suhoy-dlya-sobak-melkih-porod-s-kuricey.html,Grand Prix,"Корм сухой для собак мелких пород с курицей, 2.5 кг",1279,1279,145559
https://4lapy.ru/catalog/sobaki/korm-sobaki/sukhoy-korm-sobaki/suhoy-korm-dlya-vzroslyh-sobak-melkih-porod-losos-i-yachmen-pak-1kg.html,Guabi Natural,"Natural Dog Сухой корм для взрослых собак мелких пород с лососем и ячменем, 1 кг",1140,1140,159414
https://4lapy.ru/catalog/sobaki/korm-sobaki/konservy-korm-sobaki/teishibo-korm-vlazhnyy-dlya-sobak-kurinoe-file-s-ovoshchami-v-zhele-80g.html,INABA CIAO,"Teishibo Корм влажный для собак, куриное филе с овощами в желе, 80 гр.",189,189,164103
https://4lapy.ru/catalog/sobaki/korm-sobaki/konservy-korm-sobaki/gurman-myasnoe-assorti-340g-dlya-sobak-s-serdcem.html,Четвероногий Гурман,"Консервы для собак Мясное ассорти с сердцем, 340 г",179,179,135631
