ссылка на товар,бренд,наименование,промо цена,регулярная цена,id товара
https://4lapy.ru/catalog/sobaki/tovary-dlya-shchenkov/korm-zaveli-shchenka/holistic-suhoy-korm-dlya-shchenkov-s-yagnenkom-i-lososem-2-7-kg.html,Grandin,"Holistic Сухой корм для щенков, с ягненком и лососем, 2,7 кг",3499,3499,140807
https://4lapy.ru/catalog/sobaki/korm-sobaki/sukhoy-korm-sobaki/gipoallergennyy-suhoy-korm-dlya-sobak-vseh-porod-yagnenok-11-2kg.html,Grandin,"Hypoallergenic Гипоаллергенный сухой корм для собак всех пород, ягненок, 11,2 кг",8999,8999,135840
https://4lapy.ru/catalog/sobaki/korm-sobaki/sukhoy-korm-sobaki/ownat-gf-just-korm-suhoy-dlya-vzroslyh-sobak-s-yagnenkom-14-kg.html,Ownat,"Adult Grain Free Сухой корм беззерновой для взрослых собак, с ягненком, 14 кг",7999,7999,124635
https://4lapy.ru/catalog/sobaki/korm-sobaki/sukhoy-korm-sobaki/holistic-suhoy-korm-dlya-sobak-srednih-i-krupnyh-porod-s-yagnenkom-11-2-kg.html,Grandin,"Holistic Сухой корм для собак средних и крупных пород, с ягненком, 11,2 кг",8949,8949,140805
https://4lapy.ru/catalog/sobaki/korm-sobaki/sukhoy-korm-sobaki/ownat-ultra-korm-dlya-sobak-krupnyh-porod-s-kuricey-i-indeykoy-pak-3kg.html,Ownat,"Maxi Adult Ultra Сухой корм для собак крупных пород, с курицей и индейкой, 14 кг",7299,7299,117430
https://4lapy.ru/catalog/sobaki/korm-sobaki/sukhoy-korm-sobaki/avva-korm-dlya-vzroslyh-sobak-s-yagnenkom-i-risom-mesh-12kg.html,Aвва,"Natural Ingredients Сухой корм для взрослых собак с ягненком и рисом, 12 кг",4999,4999,117413
https://4lapy.ru/catalog/sobaki/korm-sobaki/sukhoy-korm-sobaki/prime-korm-dlya-sobak-melkih-porod-bezzernovoy-s-yagnenkom.html,Ownat,"Mini Grain Free Сухой корм беззерновой для собак мелких пород, с ягненком, 3 кг",2865,2865,124642
https://4lapy.ru/catalog/sobaki/korm-sobaki/sukhoy-korm-sobaki/Avva_Premium_Grain_Free_bezzernovoy_suhoy_korm_dlya_sobak_vseh_porod_yagnenokkartofel.html,Aвва,"Premium Grain Free Adult сухой корм для собак всех пород старше 1 года, с ягненком и картофелем, 12 кг",5999,5999,44117
https://4lapy.ru/catalog/sobaki/tovary-dlya-shchenkov/korm-zaveli-shchenka/ownat-ultra-korm-dlya-shchenkov-krupnyh-porod-s-kuricey-i-indeykoy-pak-3kg.html,Ownat,"Maxi Junior Ultra Сухой корм для щенков крупных пород, с курицей и индейкой, 14 кг",8499,8499,117437
https://4lapy.ru/catalog/sobaki/tovary-dlya-shchenkov/korm-zaveli-shchenka/farmina-n-d-dog-gf-pumpkin-lamb-blueberry-puppy-medium-maxi-2-5-kg.html,Farmina,"N&D PUMPKIN сухой корм для щенков средних и крупных пород, с ягненком, тыквой и черникой, 12кг",13499,13499,119939
https://4lapy.ru/catalog/sobaki/korm-sobaki/sukhoy-korm-sobaki/fresh-meat-suhoy-korm-dlya-sobak-melkih-porod-s-kuricey-1-5-kg1.html,Grandin,"Fresh Meat Сухой корм для собак мелких пород, с курицей, 1,5 кг",1459,1459,140803
https://4lapy.ru/catalog/sobaki/korm-sobaki/sukhoy-korm-sobaki/Avva_Premium_suhoy_korm_dlya_shchenkov_krupnyh_porod_kuritsa.html,Aвва,"Premium Puppy Large сухой корм для щенков крупных пород, с курицей, 3 кг",1399,1399,43590
https://4lapy.ru/catalog/sobaki/tovary-dlya-shchenkov/korm-zaveli-shchenka/avva-korm-dlya-shchenkov-krupnyh-porod-s-kuricey-mesh-12kg.html,Aвва,"Natural Ingredients Сухой корм для щенков крупных пород, с курицей, 12 кг",4999,4999,117416
https://4lapy.ru/catalog/sobaki/korm-sobaki/sukhoy-korm-sobaki/korm-dlya-vzroslyh-sobak-vseh-porod-s-chuvstvitelnym-pishchevareniem-indeykai-ris-3kg.html,Aвва,"Premium Sensitive Adult All Breeds Сухой корм для взрослых собак всех пород с чувствительным пищеварением, индейка и рис, 12 кг",4959,4959,91553
https://4lapy.ru/catalog/sobaki/korm-sobaki/sukhoy-korm-sobaki/gf-hypo-korm-suhoy-gipoallergennyy-dlya-sobak-s-lososem-3-kg.html,Ownat,"Grain Free Hypoallergenic Корм сухой гипоаллергенный для собак с лососем, 12 кг",8999,8999,155311
https://4lapy.ru/catalog/sobaki/korm-sobaki/sukhoy-korm-sobaki/korm-suhoy-na-osnove-svezhego-myasa-dlya-vzroslyh-sobak-vseh-porod-s-yagnenkom-i-risom-3-kg.html,Aвва,"Fresh meat Корм сухой на основе свежего мяса для взрослых собак всех пород, с ягненком и рисом, 12 кг",5689,5689,163798
https://4lapy.ru/catalog/sobaki/korm-sobaki/dieticheskiy-korm-sobaki/vet-life-natural-diet-dog-gastrointestinal.html,Farmina,"Vet Life Gastrointestinal диетический влажный корм для собак при заболеваниях ЖКТ, 300г",459,459,120016
https://4lapy.ru/catalog/sobaki/korm-sobaki/sukhoy-korm-sobaki/korm-suhoy-dlya-sobak-s-yagnenkom-i-indeykoy.html,Grandorf,"Корм сухой для собак средних и крупных пород, с ягненком и индейкой, 10 кг",8995,8995,153898
https://4lapy.ru/catalog/sobaki/korm-sobaki/dieticheskiy-korm-sobaki/vet-life-natural-diet-dog-ultrahypo-2-kg.html,Farmina,"Vet Life UltraHypo диетический сухой корм для собак, гипоаллергенный, 2кг",3899,3899,120036
https://4lapy.ru/catalog/sobaki/korm-sobaki/konservy-korm-sobaki/grandin-kons-200g-dlya-sobak-s-yagnenkom-i-lnyanym-maslom.html,Grandin,"Adult Влажный корм (консервы) для взрослых собак всех пород, с ягненком и льняным маслом, 400 гр.",219,219,137565
https://4lapy.ru/catalog/sobaki/korm-sobaki/sukhoy-korm-sobaki/ownat-classic-korm-sukhoy-dlya-sobak-s-utkoy.html,Ownat,"Adult Classic сухой корм для собак, с уткой, 12 кг",5899,5899,155069
https://4lapy.ru/catalog/sobaki/korm-sobaki/dieticheskiy-korm-sobaki/vet-life-natural-diet-dog-hypoallergenic-fish-potato-2-kg.html,Farmina,"Vet Life Hypoallergenic диетический сухой корм для собак, гипоаллергенный, 2кг",3429,3429,120030
https://4lapy.ru/catalog/sobaki/korm-sobaki/sukhoy-korm-sobaki/suhoy-korm-grandorf-dlya-vzroslyh-sobak-melkih-porod-yagnenok-s-risom-1kg.html,Grandorf,"Сухой корм для взрослых собак мелких пород, ягненок с индейкой, 3 кг",3445,3445,112538
https://4lapy.ru/catalog/sobaki/korm-sobaki/sukhoy-korm-sobaki/avva-premium-suh-2kg-dlya-sobak-vseh-porod-yagnenok-i-ris.html,Aвва,"Premium Adult Сухой корм для собак всех пород, ягненок и рис, 12 кг",4399,4399,148088
https://4lapy.ru/catalog/sobaki/korm-sobaki/holistik/farmina-n-d-dog-gf-pumpkin-lamb-blueberry-adult-medium-maxi-2-5-kg.html,Farmina,"N&D PUMPKIN сухой корм для собак средних и крупных пород, с ягненком, тыквой и черникой, 12кг",12999,12999,119932
https://4lapy.ru/catalog/sobaki/korm-sobaki/dieticheskiy-korm-sobaki/vet-life-natural-diet-dog-gastro-intestinal-2-kg.html,Farmina,"Vet Life Gastrointestinal диетический сухой корм для собак, при заболеваниях ЖКТ, с курицей, 2кг",2975,2975,120034
https://4lapy.ru/catalog/sobaki/korm-sobaki/sukhoy-korm-sobaki/Avva_Premium_suhoy_korm_dlya_sobak_krupnyh_porod_kuritsa.html,Aвва,"Premium Adult Large сухой корм для собак крупных пород старше 1 года, с курицей, 12 кг",4599,4599,45767
https://4lapy.ru/catalog/sobaki/korm-sobaki/sukhoy-korm-sobaki/suhoy-korm-grandorf-dlya-vzroslyh-sobak-vseh-porod-yagnenok-s-risom-3kg.html,Grandorf,"Сухой корм для взрослых собак средних и крупных пород, ягненок с индейкой, 3 кг",3445,3445,112540
https://4lapy.ru/catalog/sobaki/korm-sobaki/konservy-korm-sobaki/grandin-kons-200g-dlya-sobak-s-govyadinoy-i-lnyanym-maslom.html,Grandin,"Adult Влажный корм (консервы) для взрослых собак всех пород, с говядиной и льняным маслом, 400 гр.",219,219,137564
https://4lapy.ru/catalog/sobaki/korm-sobaki/sukhoy-korm-sobaki/avva-korm-dlya-vzroslyh-sobak-krupnyh-porod-s-kuricey-mesh-12kg.html,Aвва,"Natural Ingredients Сухой корм для взрослых собак крупных пород, с курицей, 12 кг",4799,4799,117410
https://4lapy.ru/catalog/sobaki/korm-sobaki/holistik/farmina-n-d-dog-gf-pumpkin-lamb-blueberry-adult-mini-800-gr.html,Farmina,"N&D PUMPKIN сухой корм для собак мелких пород, с ягненком, тыквой и черникой, 2,5кг",3672,4079,119928
https://4lapy.ru/catalog/sobaki/korm-sobaki/sukhoy-korm-sobaki/ownat-ultra-korm-dlya-sobak-srednih-porod-s-yagnenkom-i-risom-pak-3kg.html,Ownat,"Medium Adult Ultra Сухой корм для собак средних пород, с ягненком и рисом, 3 кг",2729,2729,117434
https://4lapy.ru/catalog/sobaki/korm-sobaki/sukhoy-korm-sobaki/suhoy-korm-grandorf-dlya-vzroslyh-sobak-melkih-porod-chetyre-vida-myasa-s-burym-risom-1kg.html,Grandorf,"Сухой корм для взрослых собак мелких пород, четыре вида мяса, 3 кг",3565,3565,112550
https://4lapy.ru/catalog/sobaki/korm-sobaki/sukhoy-korm-sobaki/ownat-gf-just-korm-suhoy-dlya-vzroslyh-sobak-s-utkoy-14-kg.html,Ownat,"Adult Grain Free Сухой корм для взрослых собак, с уткой, 14 кг",8399,8399,124637
https://4lapy.ru/catalog/sobaki/korm-sobaki/sukhoy-korm-sobaki/korm-suhoy-dlya-sobak-krupnyh-porod-s-yagnenkom-risom-i-bobami.html,UNICA,"Maxi сухой корм для собак крупных пород с ягненком, рисом и бобами, 12 кг",5999,5999,146414
https://4lapy.ru/catalog/sobaki/korm-sobaki/sukhoy-korm-sobaki/ownat-just-korm-dlya-sobak-bezzernovoy-s-lososem-i-moreproduktami-pak-3kg.html,Ownat,"Grain Free Just Сухой корм беззерновой для собак, с лососем и морепродуктами, 3 кг",2325,2325,117427
https://4lapy.ru/catalog/sobaki/korm-sobaki/dieticheskiy-korm-sobaki/Purina_Veterinary_Diets_EN_konservirovannyy_korm_dlya_sobak_pri_patologii_GKT_bn__400g_1001654.html,PRO PLAN® Veterinary Diets,"Veterinary Diets EN Gastrointestinal влажный корм для взрослых собак при расстройствах пищеварения и экзокринной недостаточности поджелудочной железы, паштет, 400 г",475,475,42612
https://4lapy.ru/catalog/sobaki/korm-sobaki/sukhoy-korm-sobaki/ownat-classic-korm-sukhoy-dlya-sobak-s-ryboy.html,Ownat,"Adult Classic Корм сухой для собак, с рыбой, 4 кг",1749,1749,138288
https://4lapy.ru/catalog/sobaki/korm-sobaki/sukhoy-korm-sobaki/korm-suhoy-dlya-sobak-s-yagnenkom-i-indeykoy1.html,Grandorf,"Корм сухой для собак крупных пород, с ягненком и индейкой, 10 кг",8995,8995,153900
https://4lapy.ru/catalog/sobaki/korm-sobaki/sukhoy-korm-sobaki/regional-ocean-korm-suhoy-dlya-sobak.html,Dog & Dog Wild,"Regional Ocean Сухой корм для собак, с лососем и треской, 12 кг",7299,7299,147002
https://4lapy.ru/catalog/sobaki/korm-sobaki/sukhoy-korm-sobaki/Royal_Canin_Maxi_Adult_26_suhoy_korm_dlya_sobak_krupnyh_porod.html,Royal Canin,"Maxi Adult 26 корм для собак от 15 месяцев до 5 лет,15 кг",7729,7729,42376
https://4lapy.ru/catalog/sobaki/korm-sobaki/sukhoy-korm-sobaki/suhoy-korm-grandorf-dlya-yuniorov-vseh-porod-yagnenok-s-risom-3kg.html,Grandorf,"Сухой корм для юниоров всех пород, ягненок с индейкой, 10 кг",8995,8995,155676
https://4lapy.ru/catalog/sobaki/korm-sobaki/sukhoy-korm-sobaki/avva-premium-suh-2kg-dlya-sobak-krupnyh-porod-kurica.html,Aвва,"Premium Adult Сухой корм для собак крупных пород, курица, 12 кг",4199,4199,148094
https://4lapy.ru/catalog/sobaki/tovary-dlya-shchenkov/korm-zaveli-shchenka/avva-premium-suh-2kg-dlya-shchenkov-krupnyh-porod-indeyka.html,Aвва,"Premium Puppy Сухой корм для щенков крупных пород, индейка, 12 кг",4349,4349,148091
https://4lapy.ru/catalog/sobaki/korm-sobaki/sukhoy-korm-sobaki/Royal_Canin_Mini_Adult_27_suhoy_korm_dlya_sobak_melkih_porodr.html,Royal Canin,"Mini Adult корм для взрослых собак малых пород с 10 месяцев до 8 лет, 2 кг",1390,1635,42407
https://4lapy.ru/catalog/sobaki/korm-sobaki/konservy-korm-sobaki/Yummy_Myasnoy_Delikates_konservirovannyy_korm_dlya_sobak_telyatina_naturalnaya_v_gele.html,Yummy,"Мясной Деликатес консервы для собак, с натуральной телятиной в желе, 240 г",199,199,46915
https://4lapy.ru/catalog/sobaki/korm-sobaki/sukhoy-korm-sobaki/fresh-meat-suhoy-korm-dlya-sobak-melkih-porod-s-yagnenkom-1-5-kg.html,Grandin,"Fresh Meat Сухой корм для собак мелких пород, с ягненком, 1,5 кг",1599,1599,140801
https://4lapy.ru/catalog/sobaki/tovary-dlya-shchenkov/korm-zaveli-shchenka/suhoy-korm-grandorf-dlya-shchenkov-vseh-porod-yagnenok-s-risom-1kg.html,Grandorf,"Сухой корм для щенков всех пород, ягненок, индейка, 3кг",3445,3445,112532
https://4lapy.ru/catalog/sobaki/korm-sobaki/sukhoy-korm-sobaki/ownat-care-dlya-sobak-vseh-porod-dermatologic-s-lososem-pak-3kg.html,Ownat,"Adult Care Dermatologic Сухой корм для собак всех пород склонных к дерматологической чувствительности, с лососем, 3 кг",2645,2645,145781
https://4lapy.ru/catalog/sobaki/korm-sobaki/sukhoy-korm-sobaki/korm-suhoy-dlya-sobak-vseh-porod-s-forelyu.html,UNICA,"Mono All Breed сухой корм для собак всех пород с форелью, 12 кг",6199,6199,146416
https://4lapy.ru/catalog/sobaki/korm-sobaki/sukhoy-korm-sobaki/Pro_Plan_Adult_suhoy_korm_dlya_sobak_s_chuvstvitelnym_pishchevareniem_yagnenokris.html,PRO PLAN®,"Opti Digest сухой корм для взрослых собак для средних пород при чувствительном пищеварении с ягненком, 14 кг",7336,9169,42347
https://4lapy.ru/catalog/sobaki/korm-sobaki/sukhoy-korm-sobaki/ownat-ultra-dlya-sterilizovannyh-sobak-srednih-porod-3-kg.html,Ownat,"Medium Sterilized Ultra Сухой корм для стерилизованных собак средних пород, 3 кг",2745,2745,113399
https://4lapy.ru/catalog/sobaki/korm-sobaki/sukhoy-korm-sobaki/sukhoy-korm-na-osnove-svezhego-myasa-dlya-vzroslykh-sobak-melkikh-porod-s-yagnenkom-400g.html,Aвва,"Сухой корм на основе свежего мяса для взрослых собак мелких пород, с ягненком 1,5 кг",1299,1299,154325
https://4lapy.ru/catalog/sobaki/korm-sobaki/dieticheskiy-korm-sobaki/Royal_Canin_Gastro_Intestinal_GI_korm_dieticheskiy_suhoy_dlya_sobak.html,Royal Canin,"Gastro Intestinal GI25 корм для собак при нарушении пищеварения, 2 кг",2947,2947,42649
https://4lapy.ru/catalog/sobaki/korm-sobaki/holistik/farmina-n-d-nizkozernovoy-dog-yagnenok-spelta-oves-i-chernika-dlya-vzroslyh-sobak-mini-800g.html,Farmina,"Mini низкозерновой сухой корм для взрослых собак мелких пород, с ягненком, спельтой, овсом и черникой, 2,5кг",3195,3195,137261
https://4lapy.ru/catalog/sobaki/korm-sobaki/holistik/farmina-n-d-nizkozernovoy-dog-yagnenok-spelta-oves-i-chernika-dlya-vzroslyh-sobak-medium-i-maksi-2-5kg.html,Farmina,"Medium&Maxi низкозерновой сухой корм для взрослых собак средних и крупных пород, с ягненком, спельтой, овсом и черникой, 12кг",9999,9999,137267
https://4lapy.ru/catalog/sobaki/tovary-dlya-shchenkov/korm-zaveli-shchenka/Royal_Canin_Medium_Junior_32_suhoy_korm_dlya_shchenkov.html,Royal Canin,"Medium Puppy корм для щенков средних пород 2-12 мес с 2 до 12 месяцев, 3 кг",1904,2239,79897
https://4lapy.ru/catalog/sobaki/korm-sobaki/konservy-korm-sobaki/Yummy_Myasnoy_Delikates_konservirovannyy_korm_dlya_sobak_indeyka_naturalnaya_v_gele.html,Yummy,"Мясной Деликатес консервы для собак, с натуральной индейкой в желе, 240 г",185,185,46901
https://4lapy.ru/catalog/sobaki/korm-sobaki/sukhoy-korm-sobaki/Royal_Canin_Medium_Adult_suhoy_korm_dlya_sobak_srednih_porod_ves_vzrosloy_osobi_ot_11_kg_do_25.html,Royal Canin,"Корм сухой для собак средних пород 11-25 кг., пак. 3 кг",1802,2119,84191
https://4lapy.ru/catalog/sobaki/korm-sobaki/konservy-korm-sobaki/Yummy_Myasnoy_Delikates_konservirovannyy_korm_dlya_shchenkov_govyadina_naturalnaya_v_gele.html,Yummy,"Мясной Деликатес консервы для щенков, с натуральной говядиной в желе, 240 г",199,199,46900
https://4lapy.ru/catalog/sobaki/korm-sobaki/konservy-korm-sobaki/AVVA_konservirovannyy_korm_dlya_sobak_so_vkusom_govyadiny_750_g_1005192.html,Aвва,"консервы для собак средних и крупных пород, с говядиной, 750 г",279,279,45712
https://4lapy.ru/catalog/sobaki/korm-sobaki/dieticheskiy-korm-sobaki/Royal_Canin_Hypoallergenicall_Dog_dieticheskiy_suhoy_korm_dlya_sobak.html,Royal Canin,"Hypoallergenic Small Dog Сухой корм диетический для собак малых пород весом менее 10 кг с пищевой аллергией, 1 кг",1579,1579,42654
https://4lapy.ru/catalog/sobaki/korm-sobaki/dieticheskiy-korm-sobaki/vet-life-natural-diet-dog-hypoallergenic-duck-potato.html,Farmina,"Vet Life Hypoallergenic диетический влажный корм для собак, гипоаллергенный, с уткой и картофелем, 300г",459,459,120018
https://4lapy.ru/catalog/sobaki/korm-sobaki/dieticheskiy-korm-sobaki/Purina_Veterinary_Diets_EN_dieticheskiy_suhoy_korm_dlya_sobak_pri_GKT.html,PRO PLAN® Veterinary Diets,"Veterinary Diets EN Gastrointestinal сухой корм для щенков и взрослых собак при расстройствах пищеварения и экзокринной недостаточности поджелудочной железы, 1,5 кг",2525,2525,42636
https://4lapy.ru/catalog/sobaki/korm-sobaki/sukhoy-korm-sobaki/Hills_Standard_suhoy_korm_dlya_sobak_yagnenokris.html,Hill's,"Science Plan Сухой корм для взрослых собак средних пород для поддержания иммунитета, с ягненком и рисом, 12 кг",9199,9199,45780
https://4lapy.ru/catalog/sobaki/tovary-dlya-shchenkov/korm-zaveli-shchenka/farmina-n-d-dog-gf-pumpkin-lamb-blueberry-puppy-mini-800-gr.html,Farmina,"N&D PUMPKIN сухой корм для щенков мелких пород, с ягненком, тыквой и черникой, 2,5кг",3672,4079,119935
https://4lapy.ru/catalog/sobaki/korm-sobaki/dieticheskiy-korm-sobaki/Korm_dlya_sobak_Purina_VetDieta_NA_pri_allergii_suh__pak__3kg_1000613.html,PRO PLAN® Veterinary Diets,"Veterinary Diets HA Hypoallergenic сухой корм для взрослых собак для снижения пищевой непереносимости ингредиентов и питательных веществ, 3 кг",5129,5129,32193
https://4lapy.ru/catalog/sobaki/tovary-dlya-shchenkov/korm-zaveli-shchenka/ownat-classic-korm-sukhoy-dlya-shchenkov-s-kuritsey-new2.html,Ownat,"Junior Classic Сухой корм для щенков, с курицей, 4 кг",1606,1889,140424
https://4lapy.ru/catalog/sobaki/korm-sobaki/dieticheskiy-korm-sobaki/pd-i-d-konservy-dlya-sobak-pri-zabolevaniyakh-zhkt.html,Hill's,"Prescription Diet i/d Влажный диетический корм (консервы) для собак при расстройствах пищеварения, жкт, с индейкой, 360 гр.",477,529,148005
https://4lapy.ru/catalog/sobaki/korm-sobaki/sukhoy-korm-sobaki/Royal_Canin_Mini_Junior_33_suhoy_korm_dlya_shchenkov_melkih_porod.html,Royal Canin,"Mini Puppy корм для щенков мелких пород в возрасте с 2 до 10 месяцев, 2 кг",1433,1685,42417
https://4lapy.ru/catalog/sobaki/korm-sobaki/sukhoy-korm-sobaki/natural-instinct-korm-suhoy-dlya-shchenkov.html,Dog & Dog Wild,"Natural Instinct Сухой корм для щенков, с лососем и уткой, 12 кг",6320,7899,146999
https://4lapy.ru/catalog/sobaki/korm-sobaki/konservy-korm-sobaki/Yummy_Myasnoy_Delikates_konservirovannyy_korm_dlya_sobak_serdtse_i_pechen_v_gele.html,Yummy,"Мясной Деликатес консервы для собак, с натуральным сердцем и печенью в желе, 240 г",165,165,46902
https://4lapy.ru/catalog/sobaki/korm-sobaki/dieticheskiy-korm-sobaki/Royal_Canin_Hypoallergenic_korm_dieticheskiy_suhoy_dlya_sobak_pri_allergii.html,Royal Canin,"Hypoallergenic DR21 диета для собак с пищевой аллергией или непереносимостью, 2 кг",3065,3065,42647
https://4lapy.ru/catalog/sobaki/korm-sobaki/sukhoy-korm-sobaki/sukhoy-korm-na-osnove-svezhego-myasa-dlya-shchenkov-melkikh-porod-s-indeykoy-400g.html,Aвва,"Сухой корм на основе свежего мяса для щенков мелких пород, с индейкой, 1,5 кг",1299,1299,154323
https://4lapy.ru/catalog/sobaki/korm-sobaki/sukhoy-korm-sobaki/Royal_Canin_Maxi_Junior_32_korm_suhoy_korm_dlya_shchenkov_krupnyh_porod_do_15_mesyatsev.html,Royal Canin,"Maxi Junior 32 корм для щенков с 2 до 15 месяцев, 15 кг",8339,8339,42378
https://4lapy.ru/catalog/sobaki/korm-sobaki/sukhoy-korm-sobaki/Avva_Premium_suhoy_korm_dlya_sobak_vseh_porod_yagnenokris.html,Aвва,"Premium Adult сухой корм для собак всех пород старше 1 года, с ягненком и рисом, 3 кг",1429,1429,43597
https://4lapy.ru/catalog/sobaki/korm-sobaki/sukhoy-korm-sobaki/sukhoy-korm-na-osnove-svezhego-myasa-dlya-vzroslykh-sobak-melkikh-porod-s-utkoy-400g.html,Aвва,"Сухой корм на основе свежего мяса для взрослых собак мелких пород, с уткой, 1,5 кг",1299,1299,154327
https://4lapy.ru/catalog/sobaki/korm-sobaki/sukhoy-korm-sobaki/regional-grassland-korm-suhoy-dlya-sobak.html,Dog & Dog Wild,"Regional Grassland Сухой корм для собак, с мясом кабана, ягненка и буйвола, 12 кг",7299,7299,147005
https://4lapy.ru/catalog/sobaki/korm-sobaki/dieticheskiy-korm-sobaki/vet-life-natural-diet-dog-hypoallergenic-fish-potato.html,Farmina,"Vet Life Hypoallergenic диетический влажный корм для собак, гипоаллергенный, с рыбой и картофелем, 300г",459,459,120020
https://4lapy.ru/catalog/sobaki/korm-sobaki/sukhoy-korm-sobaki/medium-adult-sensitive-skin-korm-dlya-sobak-srednih-porod-s-chuvstvitelnoy-kozhey-s-lososem.html,PRO PLAN®,"Сухой корм для собак средних пород OptiDerma с чувствительной кожей, с высоким содержанием лосося 14 кг",7336,9169,48999
https://4lapy.ru/catalog/sobaki/korm-sobaki/holistik/grandin-kons-200g-dlya-shchenkov-s-indeykoy-i-lnyanym-maslom.html,Grandin,"Puppy Влажный корм (консервы) для щенков всех пород, с индейкой и льняным маслом, 400 гр.",219,219,137566
https://4lapy.ru/catalog/sobaki/korm-sobaki/sukhoy-korm-sobaki/premium-dog-adult-large-and-giant-s-kuricey-dlya-vzroslyh-sobak-krupnyh-i-gigantskih-porod.html,Brit,"Premium Dog Adult Large and Giant сухой корм для собак крупных и гигантских пород с курицей, 15 кг",4999,4999,139891
https://4lapy.ru/catalog/sobaki/korm-sobaki/sukhoy-korm-sobaki/suhoy-korm-grandorf-dlya-vzroslyh-sobak-vseh-porod-krolik-s-kartofelem-1kg.html,Grandorf,"Сухой корм для взрослых собак средних и крупных пород, кролик с индейкой, 3 кг",3565,3565,112547
https://4lapy.ru/catalog/sobaki/korm-sobaki/dieticheskiy-korm-sobaki/ppvd-ha-sobaka-allergiya-muss-12h400g.html,PRO PLAN® Veterinary Diets,"HA Hypoallergenic Влажный диетический корм (консервы) для собак при пищевой непереносимости, 400 гр.",525,525,120477
https://4lapy.ru/catalog/sobaki/korm-sobaki/sukhoy-korm-sobaki/Nasha_Marka_suhoy_korm_dlya_sobak_vseh_sobak_yagnenokris.html,Наша Марка,"Сухой корм гипоаллергенный для собак всех пород старше 1 года, с ягненком и рисом, 12 кг",2389,2389,85050
