ссылка на товар,бренд,наименование,промо цена,регулярная цена,id товараhttps://4lapy.ru/catalog/sobaki/korm-sobaki/konservy-korm-sobaki/konservy-dlya-sobak-vseh-porod-govyadina-240g.html,Aвва,"Adult Консервы для взрослых собак всех пород, говядина, 240 гр.",143,143,149590
https://4lapy.ru/catalog/sobaki/korm-sobaki/dieticheskiy-korm-sobaki/Royal_Canin_Urinary_SO_korm_dieticheskiy_suhoy_dlya_sobak_pri_MKB.html,Royal Canin,"Urinary S/O LP18 Сухой корм при заболеваниях дистального отдела мочевыделительной системы у собак, 2 кг",2887,2887,42645
https://4lapy.ru/catalog/sobaki/korm-sobaki/konservy-korm-sobaki/Gurman_Platinum_konservirovannyy_korm_dlya_sobak_geludochki_indyushinye_v_gele_bn__240g_1006167.html,Четвероногий Гурман,"Platinum Line консервы для собак, желудочки индюшиные в желе, 240 г",159,187,42108
https://4lapy.ru/catalog/sobaki/korm-sobaki/konservy-korm-sobaki/Gurman_Myasnoe_assorti_konservirovannyy_korm_dlya_sobak_yazyk.html,Четвероногий Гурман,"Консервы для собак, мясное ассорти с языком, 340 г",189,189,43557
https://4lapy.ru/catalog/sobaki/korm-sobaki/konservy-korm-sobaki/AVVA_konservirovannyy_korm_dlya_shchenkov_govyadina_410_g_1005634.html,Aвва,"Консервы для щенков всех пород, с говядиной, 410 гр.",169,169,43528
https://4lapy.ru/catalog/sobaki/korm-sobaki/konservy-korm-sobaki/AVVA_konservirovannyy_korm_dlya_sobak_so_vkusom_govyadiny_i_baraniny_750_g_1005194.html,Aвва,"консервы для собак средних и крупных пород, с говядиной и бараниной, 750 г",279,279,45724
https://4lapy.ru/catalog/sobaki/korm-sobaki/dieticheskiy-korm-sobaki/Hills_Metabolic_dieticheskiy_suhoy_korm_dlya_sobak_dlya_korrektsii_vesa_15_kg_1007382.html,Hill's,"Prescription Diet Metabolic Сухой диетический корм для собак, способствующий снижению и контролю веса, с курицей, 1,5 кг",2202,2935,42668
https://4lapy.ru/catalog/sobaki/korm-sobaki/konservy-korm-sobaki/Gurman_Golden_konservirovannyy_korm_dlya_sobak_kuritsa_naturalnaya_v_gele_100_g_1006165.html,Четвероногий Гурман,"Golden Line консервы для собак, с курицей, 100 г",139,139,42105
https://4lapy.ru/catalog/sobaki/korm-sobaki/dieticheskiy-korm-sobaki/Purina_Veterinary_Diets_NF_konservirovannyy_korm_dlya_sobak_pri_patologii_pochek_bn__400g_1001653.html,PRO PLAN® Veterinary Diets,"NF Renal Function Влажный диетический корм (консервы) для собак при хронической почечной недостаточности, 400 гр.",475,475,42610
https://4lapy.ru/catalog/sobaki/korm-sobaki/konservy-korm-sobaki/kolbasa-dlya-sobak-myasnoy-racion-s-rubcom-500g.html,Yummy,"Колбаса для собак мясной рацион с рубцом, 500г",235,235,127727
https://4lapy.ru/catalog/sobaki/korm-sobaki/sukhoy-korm-sobaki/Korm_dlya_sobak_krup_porod_kurri__Proplan_pak__3kg_1007080.html,PRO PLAN®,"Сухой корм для взрослых собак крупных пород с атлетическим телосложением, с высоким содержанием курицы, 14 кг",6380,7975,42352
https://4lapy.ru/catalog/sobaki/korm-sobaki/sukhoy-korm-sobaki/korm-suhoy-dlya-vzroslyh-sobak-myasnoy-racion.html,Sirius,"Корм сухой для взрослых собак, мясной рацион, 15 кг",5245,5245,146285
https://4lapy.ru/catalog/sobaki/korm-sobaki/holistik/avva-kons-400g-dlya-sobak-yagnenok-s-risom.html,Aвва,"Adult Консервы для взрослых собак всех пород, ягненок с рисом, 400 гр.",209,209,137549
https://4lapy.ru/catalog/sobaki/korm-sobaki/konservy-korm-sobaki/Gurman_Golden_Korm_konservirovannyy_dlya_sobak_konina_naturalnaya_v_gele_bn__340g_1012242.html,Четвероногий Гурман,"Golden Line консервы для собак, с кониной, 340 г",335,335,48671
https://4lapy.ru/catalog/sobaki/korm-sobaki/sukhoy-korm-sobaki/korm-suhoy-dlya-vzroslyh-sobak-srednih-porod-kurica.html,Brit,"Сухой корм для взрослых собак средних пород с курицей, 3 кг",1165,1165,137912
https://4lapy.ru/catalog/sobaki/korm-sobaki/sukhoy-korm-sobaki/korm-suhoy-dlya-sobak-melkih-porod-s-tuncom.html,UNICA,"Adult Mini Sensitive сухой корм для собак мелких пород с тунцом, 2 кг",756,1079,147014
https://4lapy.ru/catalog/sobaki/korm-sobaki/sukhoy-korm-sobaki/Avva_Premium_suhoy_korm_dlya_sobak_melkih_porod_yagnenokris.html,Aвва,"Premium Adult Small Сухой корм для собак мелких пород старше 1 года, с ягненком и рисом, 800 гр.",579,579,42484
https://4lapy.ru/catalog/sobaki/korm-sobaki/sukhoy-korm-sobaki/korm-suhoy-dlya-sobak-krupnyh-porod-s-govyadinoy.html,AlphaPet,"Сухой корм для собак крупных пород с говядиной, 12 кг",7445,7445,146261
https://4lapy.ru/catalog/sobaki/korm-sobaki/dieticheskiy-korm-sobaki/korm-vlazhnyy-dlya-sobak-i-d-dlya-zhkt-360g.html,Hill's,"Prescription Diet i/d Low Fat Влажный диетический корм (консервы) для собак при расстройствах пищеварения с низким содержанием жира, 360 гр.",432,479,159195
https://4lapy.ru/catalog/sobaki/korm-sobaki/sukhoy-korm-sobaki/Royal_Canin_Giant_Adult_28_suhoy_korm_dlya_sobak_ochen_krupnyh_porod_15_kg_1000618.html,Royal Canin,"Giant Adult 28 корм для взрослых собак гигантских пород старше 18/24 месяцев, 15 кг",7355,7355,42370
https://4lapy.ru/catalog/sobaki/korm-sobaki/konservy-korm-sobaki/konservy-dlya-sobak-vseh-porod-indeyka-utka-i-yabloko-240g.html,Aвва,"Adult Консервы для взрослых собак всех пород, индейка, утка и яблоко, 240 гр.",143,143,149592
https://4lapy.ru/catalog/sobaki/korm-sobaki/holistik/konsersy-dlya-sobak-s-indeykoy-yablokami-i-otrubyami.html,Berkley,"Консервы для собак с индейкой, яблоками и отрубями, 200гр.",153,153,139009
https://4lapy.ru/catalog/sobaki/korm-sobaki/konservy-korm-sobaki/Dr_Alders_Garant_konservirovannyy_korm_dlya_sobak_rubetsserdtse_750_g_1016853.html,Dr. Alder's,"Алдерс Гарант консервы для взрослых собак, рубленое мясо рубец и сердце, 750 г",276,345,47003
https://4lapy.ru/catalog/sobaki/korm-sobaki/konservy-korm-sobaki/Gurman_Platinum_konservirovannyy_korm_dlya_sobak_kaltyki_i_yazyka_v_gele_bn__240g_1005553.html,Четвероногий Гурман,"Platinum Line консервы для собак, калтыки и языки в желе, 240 г",159,187,42095
https://4lapy.ru/catalog/sobaki/korm-sobaki/sukhoy-korm-sobaki/korm-suhoy-dlya-sobak-melkih-porod-sterilayzd.html,Royal Canin,"Mini Sterilised сухой корм для стерилизованных собак маленьких пород, 3кг",3049,3049,98494
https://4lapy.ru/catalog/sobaki/korm-sobaki/holistik/avva-kons-100g-dlya-sobak-melkih-porod-krolik-s-ovoshchami.html,Aвва,"Adult Консервы для взрослых собак мелких пород, кролик с овощами, 100 гр.",99,99,137535
https://4lapy.ru/catalog/sobaki/korm-sobaki/sukhoy-korm-sobaki/Trapeza_suh__10kg_Dsobak_Optimal_1022651.html,Трапеза,"Optimal корм для собак всех пород старше 1 года, живущих в городских условиях, 10 кг",1885,1885,49198
https://4lapy.ru/catalog/sobaki/tovary-dlya-shchenkov/korm-zaveli-shchenka/farmina-n-d-dog-lamb-pumpkin-blueberry-puppy.html,Farmina,"N&D PUMPKIN влажный корм для щенков, с ягненком, тыквой и черникой, 285г",599,599,119963
https://4lapy.ru/catalog/sobaki/korm-sobaki/holistik/avva-kons-400g-dlya-sobak-cyplenok-s-syrom.html,Aвва,"Adult Консервы для взрослых собак всех пород, цыпленок с сыром, 400 гр.",209,209,137551
https://4lapy.ru/catalog/sobaki/korm-sobaki/sukhoy-korm-sobaki/Pro_Plan_suhoy_korm_dlya_sobak_krupnyh_porod_s_atleticheskim_teloslogeniem_yagnenok.html,PRO PLAN®,"Opti Digest сухой корм для взрослых собак для крупных пород с атлетическим телосложением при чувствительном пищеварении с ягненком, 14 кг",7336,9169,42364
https://4lapy.ru/catalog/sobaki/korm-sobaki/holistik/konsersy-dlya-sobak-s-yagnenkom-i-risom.html,Berkley,"Консервы для собак с ягненком и рисом, 200гр.",153,153,138999
https://4lapy.ru/catalog/sobaki/korm-sobaki/konservy-korm-sobaki/vlazhnyy-korm-dlya-sobak-s-chuvstvitelnym-pishchevareniem-s-krolikom-i-yablokom-v-souse-100g.html,AlphaPet,"Влажный корм для собак с чувствительным пищеварением, с кроликом и яблоком в соусе, 100 гр.",79,79,155232
https://4lapy.ru/catalog/sobaki/korm-sobaki/holistik/avva-kons-200g-dlya-sobak-krolik-s-risom-dlya-vzroslyh-sobak-vseh-porod.html,Aвва,"Adult Консервы для взрослых собак всех пород, кролик с рисом, 200 гр.",133,133,137543
https://4lapy.ru/catalog/sobaki/korm-sobaki/dieticheskiy-korm-sobaki/Royal_Canin_Sensitivity_Control_dieticheskiy_suhoy_korm_dlya_sobak_pri_pishchevoy_neperenosimosti.html,Royal Canin,"Sensitivity Control SC21 корм для собак при пищевой аллергии или непереносимости, 1,5 кг",2305,2305,44660
https://4lapy.ru/catalog/sobaki/korm-sobaki/sukhoy-korm-sobaki/giant-puppy-korm-korm-suhoy-dlya-shchenkov-ochen-krupnyh-porod1.html,Royal Canin,"Giant Puppy 34 корм для щенков гигантских пород с 2 до 8 месяцев, 15 кг",8915,8915,42387
https://4lapy.ru/catalog/sobaki/korm-sobaki/konservy-korm-sobaki/konservy-dlya-sobak-s-indeykoy.html,Hill's,"Science Plan Консервы для взрослых собак для поддержания мышечной массы и здорового иммунитета, с индейкой, 370 гр.",292,365,137006
https://4lapy.ru/catalog/sobaki/korm-sobaki/konservy-korm-sobaki/konservy-dlya-shchenkov-vseh-porod-govyadina-240g.html,Aвва,"Puppy Консервы для щенков всех пород, говядина, 240 гр.",143,143,149598
https://4lapy.ru/catalog/sobaki/korm-sobaki/sukhoy-korm-sobaki/korm-suhoy-dlya-sobak-srednih-porod-s-yagnenkom-i-risom.html,AlphaPet,"WOW Сухой корм для собак средних пород с ягненком и рисом, 2 кг",1245,1245,146248
https://4lapy.ru/catalog/sobaki/korm-sobaki/sukhoy-korm-sobaki/premium-suhoy-korm-dlya-sobak-srednih-porod-indeyka-i-telyatina-3kg.html,Brit,"Премиум Cухой корм для собак средних пород, индейка и телятина, 3 кг",1285,1285,156028
https://4lapy.ru/catalog/sobaki/korm-sobaki/konservy-korm-sobaki/AVVA_konservirovannyy_korm_dlya_sobak_potroshki_410_g_1005633.html,Aвва,"Консервы для собак всех пород, с потрошками, 410 гр.",169,169,43526
https://4lapy.ru/catalog/sobaki/korm-sobaki/sukhoy-korm-sobaki/giant-puppy-korm-korm-suhoy-dlya-shchenkov-ochen-krupnyh-porod.html,Royal Canin,"Giant Junior сухой корм для щенков гигантских пород с 8 до 18/24 месяцев, 15кг",8915,8915,42372
https://4lapy.ru/catalog/sobaki/tovary-dlya-shchenkov/korm-zaveli-shchenka/korm-suhoy-dlya-shchenkov-melkih-porod-s-kuricey.html,UNICA,"Puppy Mini Development сухой корм для щенков мелких пород с курицей, 2 кг",540,1079,147010
https://4lapy.ru/catalog/sobaki/korm-sobaki/sukhoy-korm-sobaki/Pro_Plan_Adult_suhoy_korm_dlya_sobak_srednih_porod_kuritsaris.html,PRO PLAN®,"Everyday Nutrition Сухой корм для взрослых собак средних пород, с высоким содержанием курицы, 3 кг",1632,2039,42336
https://4lapy.ru/catalog/sobaki/tovary-dlya-shchenkov/korm-zaveli-shchenka/farmina-n-d-nizkozernovoy-dog-yagnenok-spelta-oves-i-chernika-dlya-shchenkov-mini-800g.html,Farmina,"Puppy Mini низкозерновой сухой корм для щенков мелких пород, с ягненком, спельтой, овсом и черникой, 800гр",1463,1463,137237
https://4lapy.ru/catalog/sobaki/korm-sobaki/konservy-korm-sobaki/konservy-dlya-shchenkov-vseh-porod-cyplenok-indeyka-240g.html,Aвва,"Puppy Консервы для щенков всех пород, цыпленок и индейка, 240 гр.",143,143,149600
https://4lapy.ru/catalog/sobaki/korm-sobaki/konservy-korm-sobaki/AVVA_konservirovannyy_korm_dlya_sobak_ptitsa_410_g_1005632.html,Aвва,"Консервы для собак всех пород, с птицей, 410 гр.",169,169,43524
https://4lapy.ru/catalog/sobaki/korm-sobaki/konservy-korm-sobaki/konservy-dlya-sobak-vseh-porod-nezhnaya-telyatina-utka-240g.html,Aвва,"Adult Консервы для взрослых собак всех пород, нежная телятина и утка, 240 гр.",143,143,149594
https://4lapy.ru/catalog/sobaki/korm-sobaki/konservy-korm-sobaki/Gurman_Platinum_konservirovannyy_korm_dlya_sobak_rubets_govyagiy_v_gele_bn__240g_1005554.html,Четвероногий Гурман,"Platinum Line консервы для собак, рубец в желе, 240 г",159,187,42097
https://4lapy.ru/catalog/sobaki/korm-sobaki/konservy-korm-sobaki/vlazhnyy-korm-dlya-sobak-s-chuvstvitelnym-pishchevareniem-s-telyatinoy-i-tykvoy-v-souse-100g.html,AlphaPet,"Влажный корм для собак с чувствительным пищеварением, с телятиной и тыквой в соусе, 100 гр.",79,79,155234
https://4lapy.ru/catalog/sobaki/korm-sobaki/sukhoy-korm-sobaki/korm-suhoy-dlya-vzroslyh-sobak-s-yagnenkom-i-risom1.html,Sirius,"Корм сухой для взрослых собак, с ягненком и рисом, 2 кг",720,899,146291
https://4lapy.ru/catalog/sobaki/korm-sobaki/konservy-korm-sobaki/konservy-dlya-sobak-melkih-porod-nezhnaya-telyatina-100g.html,Aвва,"Adult Консервы для взрослых собак мелких пород, нежная телятина, 100 гр.",99,99,149586
https://4lapy.ru/catalog/sobaki/korm-sobaki/sukhoy-korm-sobaki/Pro_Plan_Adult_Small_suhoy_korm_dlya_sobak_melkih_porod_kuritsaris_3_kg_1004261.html,PRO PLAN®,"Сухой корм для взрослых собак мелких и карликовых пород, с высоким содержанием курицы, Пакет, 3 кг",2048,2559,45772
https://4lapy.ru/catalog/sobaki/korm-sobaki/sukhoy-korm-sobaki/ownat-care-korm-dlya-sobak-vseh-porod-mobility-s-kuricey-pak-3kg.html,Ownat,"Adult Care mobility Сухой корм для собак всех пород с питательными веществами для поддержки работы суставов, с курицей, 3 кг",2745,2745,145775
https://4lapy.ru/catalog/sobaki/tovary-dlya-shchenkov/korm-zaveli-shchenka/farmina-n-d-dog-lamb-pumpkin-blueberry-puppy-mini.html,Farmina,"N&D PUMPKIN влажный корм для щенков, с ягненком, тыквой, черникой, 140г",315,315,119943
https://4lapy.ru/catalog/sobaki/korm-sobaki/dieticheskiy-korm-sobaki/pd-dermcpt-korm-d-sob-d-kozh-6h1-5kg.html,Hill's,"Prescription Diet Derm Complete Сухой диетический корм для взрослых собак при аллергии, 1,5 кг",3329,3329,143051
https://4lapy.ru/catalog/sobaki/korm-sobaki/konservy-korm-sobaki/konservy-dlya-sobak-krolik-s-risom-850g.html,Aвва,"Влажный корм (консервы) для собак, кролик с рисом, 850 гр.",339,339,159161
https://4lapy.ru/catalog/sobaki/korm-sobaki/sukhoy-korm-sobaki/Royal_Canin_Mini_Starter_korm_suhoy_korm_dlya_shchenkov_melkih_porod_do_2h_mesyatsev.html,Royal Canin,"Mini Starter корм для щенков до 2-х месяцев, беременных и кормящих сук, 1 кг",989,989,42414
https://4lapy.ru/catalog/sobaki/korm-sobaki/sukhoy-korm-sobaki/premium-suhoy-korm-dlya-sobak-s-chuvstvitelnym-pishchevareniem-losos-i-indeyka-1kg.html,Brit,"Премиум Сухой корм для собак с чувствительным пищеварением, лосось и индейка, 3 кг",1579,1579,156032
https://4lapy.ru/catalog/sobaki/korm-sobaki/konservy-korm-sobaki/Gurman_Myasnoe_assorti_konservirovannyy_korm_dlya_sobak_potroha.html,Четвероногий Гурман,"Консервы для собак, мясное ассорти с потрошками, 340 г",189,189,43556
https://4lapy.ru/catalog/sobaki/tovary-dlya-shchenkov/korm-zaveli-shchenka/korm-suhoy-dlya-shchenkov-srednih-porod-s-govyadinoy-i-risom.html,AlphaPet,"Сухой корм для щенков средних пород с говядиной и рисом, 2 кг",1501,1765,146258
https://4lapy.ru/catalog/sobaki/korm-sobaki/holistik/konsersy-dlya-sobak-s-indeykoy-i-grushey.html,Berkley,"Консервы для собак с индейкой и грушей, 200гр.",153,153,139001
https://4lapy.ru/catalog/sobaki/korm-sobaki/dieticheskiy-korm-sobaki/korm-suhoy-dlya-vzroslyh-sobak-melkih-porod-dlya-resheniya-problem-s-pishchevareniem-2kg.html,UNICA,"Корм сухой для взрослых собак средних пород для решения проблем с пищеварением, 2 кг",2135,2135,159368
https://4lapy.ru/catalog/sobaki/korm-sobaki/sukhoy-korm-sobaki/trapeza-suh-10kg-d-sobak-yagnenok-ris.html,Трапеза,"Lamb and Rice корм для собак всех пород старше 1 года, с ягненком и рисом, 10 кг",2387,2387,76863
https://4lapy.ru/catalog/sobaki/korm-sobaki/holistik/avva-kons-100g-dlya-sobak-melkih-porod-indeyka-s-risom.html,Aвва,"Adult Консервы для взрослых собак мелких пород, индейка с рисом, 100 гр.",99,99,137537
https://4lapy.ru/catalog/sobaki/korm-sobaki/sukhoy-korm-sobaki/proplan-suh-2-5kg-dlya-sobak-srednih-i-krupnyh-porod-grain-free-sindeykoy.html,PRO PLAN®,"Grain Free сухой корм для взрослых собак для средних и крупных пород при чувствительном пищеварении с индейкой, 7 кг",3904,4879,96791
https://4lapy.ru/catalog/sobaki/tovary-dlya-shchenkov/korm-zaveli-shchenka/avva-kons-100g-dlya-shchenkov-yagnenok-i-ris.html,Aвва,"Puppy Консервы для щенков всех пород, с ягненком и рисом, 100 гр.",99,99,147533
https://4lapy.ru/catalog/sobaki/korm-sobaki/dieticheskiy-korm-sobaki/korm-vlazhnyy-dlya-sobak-l-d-dlya-pecheni-370g.html,Hill's,"Prescription Diet l/d Влажный диетический корм (консервы) для собак при заболеваниях печени, 370 гр.",511,567,159199
https://4lapy.ru/catalog/sobaki/korm-sobaki/dieticheskiy-korm-sobaki/Purina_Veterinary_Diets_OM_dieticheskiy_suhoy_korm_dlya_sobak_pri_ogirenii_pak__3kg_1002273.html,PRO PLAN® Veterinary Diets,"OM Obesity Management Сухой диетический корм для собак для снижения избыточной массы тела, 3 кг",4715,4715,42630
https://4lapy.ru/catalog/sobaki/korm-sobaki/sukhoy-korm-sobaki/Pro_Plan_Adultall_suhoy_korm_dlya_sobak_melkih_porod_s_chuvstvitelnoy_kogeyososris.html,PRO PLAN®,"Sensitive Skin Adult Сухой корм для взрослых собак мелких и карликовых пород с чувствительной кожей, с высоким содержанием лосося, 3 кг",2152,2689,45754
https://4lapy.ru/catalog/sobaki/korm-sobaki/konservy-korm-sobaki/Dr_Alders_Garant_konservirovannyy_korm_dlya_sobak_ptitsa_750_g_1016852.html,Dr. Alder's,"Алдерс Гарант консервы для взрослых собак, рубленое мясо птица, 750 г",276,345,47005
https://4lapy.ru/catalog/sobaki/korm-sobaki/sukhoy-korm-sobaki/farmina-n-d-nizkozernovoy-dog-kurica-spelta-oves-i-granat-dlya-vzroslyh-sobak-mini-800g.html,Farmina,"Mini низкозерновой сухой корм для взрослых собак мелких пород, с курицей, спельтой, овсом и гранатом, 2,5кг",3195,3195,137249
https://4lapy.ru/catalog/sobaki/tovary-dlya-shchenkov/korm-zaveli-shchenka/konservy-dlya-shchenkov-s-kuritsey.html,Hill's,"Science Plan Консервы для щенков для поддержания здорового роста и развития, с курицей, 370 гр.",308,385,137010
https://4lapy.ru/catalog/sobaki/korm-sobaki/holistik/konservy-dlya-sobak-s-krolikom.html,Berkley,"Консервы для собак с кроликом, 100гр.",137,137,138995
https://4lapy.ru/catalog/sobaki/korm-sobaki/sukhoy-korm-sobaki/korm-suhoy-dlya-sobak-mini-porod-s-indeykoy-i-risom.html,AlphaPet,"WOW Сухой корм для собак мини пород с индейкой и рисом, 1,5 кг",668,785,146244
https://4lapy.ru/catalog/sobaki/korm-sobaki/konservy-korm-sobaki/konservy-dlya-sobak-melkih-porod-govyadina-100g.html,Aвва,"Adult Консервы для взрослых собак мелких пород, говядина, 100 гр.",99,99,149584
https://4lapy.ru/catalog/sobaki/korm-sobaki/sukhoy-korm-sobaki/Royal_Canin_Adult_suhoy_korm_dlya_sobak_porodyabrador_Retriver.html,Royal Canin,"Labrador Retriever 30 корм для взрослого лабрадора с 15 мес, 12 кг",9325,9325,42397
https://4lapy.ru/catalog/sobaki/korm-sobaki/sukhoy-korm-sobaki/proplan-suh-700g-dlya-sobak-melkih-i-karlikovyh-porod-grain-free-sindeykoy.html,PRO PLAN®,"Grain Free сухой корм для взрослых собак для мелких и карликовых пород при чувствительном пищеварении с индейкой, 2,5 кг",2048,2559,93839
https://4lapy.ru/catalog/sobaki/korm-sobaki/konservy-korm-sobaki/avva-kons-200g-dlya-sobak-yagnenok.html,Aвва,"Adult Консервы для взрослых собак всех пород, с ягненком, 200 гр.",133,133,147538
https://4lapy.ru/catalog/sobaki/korm-sobaki/sukhoy-korm-sobaki/Korm_dlya_sobak_Royal_Kanin_Frantsuzskiy_buldog_Edalt.html,Royal Canin,"French Bulldog Adult корм для собак породы французский бульдог от 12 месяцев, 3 кг",2167,2549,42981
https://4lapy.ru/catalog/sobaki/korm-sobaki/konservy-korm-sobaki/optisavour-adult-vlazhnyy-korm-dlya-sobak-melkih-porod-c-govyadinoy-v-souse-85g.html,PRO PLAN®,"Opti Savour влажный корм для взрослых собак для мелких пород с говядиной, в соусе, 85 г",75,93,129466
https://4lapy.ru/catalog/sobaki/korm-sobaki/holistik/konservy-dlya-sobak-vseh-porod-s-cyplenkom-i-tykvoy.html,Aвва,"Adult Консервы для собак всех пород, с цыпленком и тыквой, 400 гр.",209,209,154535
https://4lapy.ru/catalog/sobaki/korm-sobaki/dieticheskiy-korm-sobaki/Purina_Veterinary_Diets_OM_konservirovannyy_korm_dlya_sobak_pri_ogirenii_bn__400g_1001652.html,PRO PLAN® Veterinary Diets,"OM Obesity Management Влажный диетический корм (консервы) для собак для снижения избыточной массы тела, паштет, 400 гр.",475,475,42608
https://4lapy.ru/catalog/sobaki/korm-sobaki/konservy-korm-sobaki/konservy-dlya-shchenkov-vseh-porod-cyplenok-indeyka-100g.html,Aвва,"Puppy Консервы для щенков всех пород, цыпленок и индейка, 100 гр.",99,99,149588
https://4lapy.ru/catalog/sobaki/korm-sobaki/sukhoy-korm-sobaki/korm-suhoy-na-osnove-svezhego-myasa-dlya-vzroslyh-sobak-vseh-porod-s-lososem-i-risom-3-kg.html,Aвва,"Fresh Meat Сухой корм для взрослых собак всех пород, с лососем и рисом, 3 кг",1649,1649,163792
https://4lapy.ru/catalog/sobaki/korm-sobaki/konservy-korm-sobaki/farmina-n-d-dog-chicken-pumpkin-pomegranate.html,Farmina,"N&D PUMPKIN влажный корм для собак, с курицей, тыквой и гранатом, 285г",599,599,119971
https://4lapy.ru/catalog/sobaki/korm-sobaki/sukhoy-korm-sobaki/korm-suhoy-dlya-sobak-mini-porod-daydzhestiv-kea.html,Royal Canin,"Mini Digestive Care сухой корм для собак маленьких пород с чувствительным пищеварением, 3кг",2715,2715,98488
https://4lapy.ru/catalog/sobaki/korm-sobaki/sukhoy-korm-sobaki/korm-suhoy-dlya-vzroslyh-sobak-malyh-porod-s-govyadinoy.html,Sirius,"Корм сухой для взрослых собак малых пород, с говядиной, 2 кг",720,899,146287
